type,title,release_year,duration,listed_in,description
TV Show,Gortimer Gibbon's Life on Normal Street,2016,3 Seasons,Kids,"As the series comes to a close, Gortimer, Mel and Ranger grow closer than ever, even as growing up threatens to pull them apart. Their adventures on Normal Street continue as Mel learns the consequences of overextending herself, Ranger takes on other people's problems while ignoring his own, and Gortimer grapples with the greatest challenge of all: leaving Normal Street"
TV Show,GooGoo: Learn Colors and vehicles with Funny Baby,2018,2 Seasons,Kids,GooGoo and GaaGaa are two 18 month old cute and curious babies. who are best friends and love to laugh. In each episode the two friends will encounter a funny shaped friend that will capture attention make them laugh and then come to life as a different musical instrument
TV Show,Gogo Dino Explorers,2018,2 Seasons,Kids,"In the far reaches of the universe there is a planet called M25, on which many species exist, including dinosaurs that became extinct on earth thousands of years ago! Meet Rex, Tomo, Viki, Ping, and Rocky, the GoGo Dinos, whose mission is to explore M25, discovering new dinosaurs and always lending a helping hand to save the day!"
TV Show,"Go with YoYo! Exercise, Yoga and Mindfulness for Kids",2020,1 Season,Kids,"GO with YOYO is a place for fitness fun and playful yoga for kids. Jump around and get moving with YOYO, twist into fun yoga poses, and exercise with props you can find at home like your stuffed animal, paper plates and lots more! By blending educational elements with brain boosting movements and our attitude of gratitude, kids are making both their muscles and their mind strong!"
TV Show,Go Go Babies in Car City,2021,1 Season,Kids,"Chili, Sunny and Berry are three cute baby cars. Every day, they go around Car City to meet its inhabitants and new discover activities... to have fun and growing up !"
TV Show,Gecko's Garage 3D - Vehicle Cartoons for Kids,2021,1 Season,Kids,"Enjoy this collection of educational kids cartoons with the all-new 3D Gecko's Garage! Gecko will help children learn colors, learn shapes, learn numbers, learn the alphabet and much more. In this collection, watch as Gecko gets Frozen, Baby Truck Loses Her Dummy and many more educational adventures."
TV Show,Garfield Specials,1990,1 Season,Kids,"Includes 9 Garfield Specials: A Garfield Christmas, A Garfield Thanksgiving, Garfield Gets A Life, Garfield Goes Hollywood, Garfield and His 9 Lives, Garfield In Paradis, Garfield In The Rough, Garfield's Babes and Bullets, and Garfield's Feline Fantasies."
TV Show,Galaxy Kids,2015,1 Season,Kids,"Luna, Zhou, Poya, Tunik, Atla, and Siny are a team of young space satellites that come together to form the Galaxy Kids! The Galaxy Kids often travel to space, where they help other satellites and extraterrestrial beings, or solve cosmic problems caused by the comical villain - Space Monkey. They also help a young boy named Cosmo train to become an astronaut."
TV Show,Fungus The Bogeyman,2015,1 Season,Kids,"Fungus the Bogeyman is a story of smelly monsters, dangerous humans, and what happens when The Things That Go Bump In The Night move in next door... It's a fantastically funny fish-out-of-water comedy where two very different families are forced to live next door to one another."
TV Show,Fireman Sam Classic,1989,5 Seasons,Kids,"Raise the alarm! If there's trouble on the ground or in the air, Fireman Sam and his crew will be there. Brave to the core, they are the ultimate heroes next door."
TV Show,Fireman Sam,2009,8 Seasons,Kids,"Fireman Sam and his team are rocketing to the rescue! On the ground or in the air, the Pontypandy firefighters will be there. Sam and his heroic team are ready for action whenever a crisis arises. Fires, zip lines, rockets, and pirates are no matches for them! These heroes are always ready to rock and roll!"
TV Show,FETCH! With Ruff Ruffman,2006,1 Season,Kids,"Part game show, part reality TV, and part spoof, FETCH! With Ruff Ruffman features real kids, real challenges, real science, and an unreal animated host – a dog named Ruff Ruffman."
TV Show,Enchantimals,2019,2 Seasons,Kids,"This season, the Enchantimals and their besties discover and explore an exciting new world full of wonder! A trip to Junglewood takes them out of Wonderwood and into a fantastical new land where they meet wonderful new friends. The girls and their Besties find that caring for each other and their newfound pals is what enchantment is really made of!"
TV Show,"Eerie, Indiana: The Other Dimension",1998,1 Season,Kids,"In this spinoff to the cult classic series, a new mystery begins for two young boys in the the seemingly ordinary town of Eerie, Indiana as they experience strange and interesting phenomena."
TV Show,Dream Defenders,2013,1 Season,Kids,"On a mission to save the world! Dream Defenders tells the story of Zane and Zoey, who are the last line of defense between the real world and the Dreamworlds. When the nightmare monsters come to life and are threatening to break through to the real world, Zane and Zoey jump in to action! What's in your dreams..."
TV Show,Dora the Explorer,2007,2 Seasons,Kids,"Along with her friend Boots, Dora goes on all kinds of adventures."
TV Show,Dive Olly Dive,2011,2 Seasons,Kids,"""Dive Olly Dive!"" follows the fun-filled underwater escapades of Olly and Beth; two young, unmanned research submarines in training. Under the guidance of their human supervisors at the research facility, they discover the marvels of the world they live in. Season Two takes our subs out of the surroundings of Safe Harbour and into the vast and wondrous oceans of the world!"
TV Show,Dinosaur Train,2010,1 Season,Kids,"Dinosaur Train embraces and celebrates the fascination that preschoolers have with both dinosaurs and trains while sparking an interest in life science, natural history and paleontology."
TV Show,Dino Dana,2020,4 Seasons,Kids,Dana is a 9-year old girl who loves dinosaurs and spends all of her time learning about them. After receiving a book she discovers she can see Dinosaurs in real life.
TV Show,Dino Dan,2014,4 Seasons,Kids,"Dino Dan: Trek's Adventures takes dinosaur adventure to the next level with 17 new prehistoric creatures, a new gang of friends, and a new Henderson brother who can see dinosaurs. 10-year old Trek has discovered his amazing new dino-seeing talent with a little help from his big brother Dan. Now Trek eats, sleeps and breathes dinosaurs because his days are filled with dino action!"
TV Show,Design Squad,2008,1 Season,Kids,Get inspired. Get wired. Get totally fired up! Get into the PBS Kids reality show Design Squad!
TV Show,Daniel Tiger's Neighborhood,2012,1 Season,Kids,"The first TV series inspired by the iconic, award-winning MISTER ROGERS' NEIGHBORHOOD, DANIEL TIGER'S NEIGHBORHOOD from The Fred Rogers Company stars 4-year-old Daniel Tiger, son of the original program's Daniel Striped Tiger, who invites young viewers into his world, giving them a kid's-eye view of his life."
TV Show,Daniel Tiger and More Snowy Adventures,2020,1 Season,Kids,"Daniel Tiger is playing the snowflake in the Neighborhood’s Snowflake Day show! Then, enjoy a Christmas-themed episode of Odd Squad and other wintery episodes from Molly of Denali and Pinkalicious and Peterrific."
TV Show,Daniel Tiger and More Incredible Stories,2018,1 Season,Kids,"Join Daniel Tiger as helpers come clean up the Neighborhood after a big storm passes through. Then, enjoy other fun-filled stories from Pinkalicious and Peterrific, Molly of Denali and more!"
TV Show,Daniel Tiger and More Halloween Fun!,2019,1 Season,Kids,"Join Daniel Tiger and your other PBS KIDS friends for fun Halloween stories! Watch as Daniel Tiger and Katerina make their costumes for dress up day. Plus, the Halloween fun continues when Xavier Riddle meets a spooky storyteller!"
TV Show,Danger & Eggs,2017,1 Season,Kids,"Danger & Eggs follows the endless adventures of a fearless, teal-haired girl named D.D. Danger (voiced by SNL's Aidy Bryant) and her ever cautious best friend, a giant talking egg named Phillip. Together, join this buddy system as they explore an underground laboratory, meet a tech-savvy raccoon, and find moments of heart in the smallest bite of broccoli."
TV Show,Cyberchase,2002,1 Season,Kids,"Three kids, Jackie, Matt, Inez and their bird friend Digit must save Cyberspace from the evil Hacker with the use of strategy and math skills."
TV Show,Curiosity Songs with Pinkfong & Hogi,2021,1 Season,Kids,Why do we hiccup? Why do we have a bellybutton? How does the rain form? Hogi is here to answer all the questions that curiosity can create!
TV Show,Creative Galaxy,2019,3 Seasons,Kids,"Follow the adventures of Arty, and his inspirational sidekick Epiphany as they soar through the Creative Galaxy fixing problems – with art! Whether it's saving the day with mixed media art, creative snacks- or even slime!- Arty always discovers new ways to come to the rescue for his family and friends."
TV Show,Costume Quest,2019,3 Seasons,Kids,"Everyone is jolly as ever at the Auburn Hollow Christmas Festival of Cheer. Wren, Reynold, Everett and Lucy are thrilled to finally enjoy a holiday without having to worry about saving the universe, but trouble looms when the monster hunter Silvia Razer arrives looking for paranormal activity. With their friends in danger, the kids must use their magic costumes once again and face this new foe."
TV Show,Cosmic Quantum Ray Series,2002,1 Season,Kids,"""Cosmic Quantum Ray"" is a zany comedy-action-adventure series that brings the strange corners of the universe to the world of Earth teenager Robbie Shipton. Robbie represents Earth as a member of Team Quantum - an elite, eccentric team of heroes that saves the Universe almost every day, and hopefully in time for Robbie to get to his third-period Science class!"
TV Show,Cosmic Kids Yoga Adventures,2017,2 Seasons,Kids,"More yoga adventures for kids with Jaime! Fun interactive stories told in yoga poses -strength, balance and confidence for kids."
TV Show,Construction Squad of Car City,2017,1 Season,Kids,"Ethan the Dump Truck, Edgar the Excavator and Charlie the Crane are the ingenious members of the Construction Squad ! When there is something new to build in Car City, it's the Construction Squad we call for! Edgar, Ethan and Charlie are always happy to improve this beautiful town and please its inhabitants!"
TV Show,Clifford's Puppy Days,2006,3 Seasons,Kids,"Before Clifford was a Big Red Dog, he was a Small Red Puppy. Clifford was the runt of his litter, and Emily Elizabeth fell in love with Little Clifford at first sight. Despite barely filling Emily Elizabeth's dad's palm, Clifford was quite the handful! Making his way in the big world was no small feat for this tiny pup, but even as a puppy he had a huge heart."
TV Show,Clifford the Big Red Dog,2021,6 Seasons,Kids,"There’s lots to celebrate this season of Clifford the Big Red Dog! All of Birdwell Island joins together for Clifford’s birthday, shares the love on Valentine’s Day and haunts the island on Halloween. From welcoming a new baby to helping the town through an extraordinary snow day, the friends share life’s special moments while learning the importance of family and celebrating true friendship."
TV Show,"Click, Clack, Moo: Christmas at the Farm",2017,1 Season,Kids,"It's Christmas time and the farm animals have a problem: how to buy Farmer Brown the present of his dreams - a Tumbletron 300 clothes dryer. It's a race against time for them, and for Duck who has his own problem - upping his ""nice"" numbers for Santa to get off the ""naughty"" list. Based on the book series by Doreen Cronin and Betsy Lewin. Starring: Rachel Bloom, Pete Davidson and Patton Oswalt."
TV Show,Classic Popeye,1960,1 Season,Kids,"Popeye is one of the most popular cartoon characters of all time. This spunky but loveable spinach-eating sailor continues to delight young and old with his comic adventures, and the entire gang is around to provide plenty of rousing fun and action: Olive Oyl, Swee'Pea, Wimpy and Bluto."
TV Show,Children's Favorite Fairy Tales and Nursery Rhymes,2016,1 Season,Kids,"This is a collection of some of the best Nursery Rhymes and Fairy Tales by Kids Learning Videos. Enjoy some favorite fairy tales such as The Three Little Pigs, Little Red Riding Hood and Goldilocks & The Three Bears."
TV Show,Child Genius,2016,2 Seasons,Kids,"Child Genius is part docu-soap, part competition. The series will bring us into a world where children far surpass their parents when it comes to brain power."
TV Show,Cave Club,2020,1 Season,Kids,"Meet Cave Club, a group of prehistoric kids who are way ahead of their time! With a mammoth world to explore, don't expect them to stay in their cave. They are determined to do everything, see everything, and discover everything-first! Which means these BFFs are about to make history!"
TV Show,Care Bears: Unlock the Music - Songs for Kids,2020,1 Season,Kids,"The Care Bears are a roly-poly collection of lovable little Bears with a very special mission. Join Tenderheart Bear, Good Luck Bear, Wish Bear, Cheer Bear, Bedtime Bear, Love-a-Lot Bear, Grumpy Bear, and Funshine Bea on plenty of adventures to spread love and care around the world!"
TV Show,Car Patrol of Car City,2019,3 Seasons,Kids,"Matt the Police Car and Franck the Fire Truck are the fearless detectives of the Car Patrol. Every time a vehicle in Car City gneeds help, the Car Patrol is there to make sure that everyone is safe. Join the Car Patrol and solve the mysteries of Car City!"
TV Show,Call Santa,2020,2 Seasons,Kids,"Give Santa Claus a ring! This holiday, you can help decorate the tree with Santa's elves, learn to laugh just like Santa, and even dance the Sleigh Bell Shimmy! With Christmas cheer at the heart of every story, these festive adventures aim to have your family ho-ho-ho-ing along with Santa and his friends."
TV Show,Caillou,2010,1 Season,Kids,"Join Caillou as he explores everyday life, where ordinary daily events spark his and your child's imagination."
TV Show,Busytown Mysteries,2009,1 Season,Kids,"Curiosities are everywhere in Busytown and so are Huckle Cat, Lowly Worm, Sally Cat, Hilda Hippo plus Pig Will and Pig Won't. Each episode is an innovative blend of humor and learning based around six unforgettable friends and many other colorful characters from the amazing world of Richard Scarry's books."
TV Show,Busy World of Richard Scarry,1996,5 Seasons,Kids,This fully animated series is based on the books by Richard Scarry which parents worldwide rely on to teach valuable lessons.
TV Show,Bug Diaries,2020,3 Seasons,Kids,"Three unlikely bug buddies, Fly, Spider and Worm, fly, spin, and jump into all kinds of adventures in the big world around them. Imagine hopping a ride on a furry dog or dodging raindrops bigger than your house! Using their unique insect abilities, our tiny heroes find ways to help themselves and others out of sticky situations and record their stories in their bug diaries!"
TV Show,Bread Barbershop,2020,1 Season,Kids,"In a world where all the characters are different kinds of food, our hero is a slice of bread who is a master cake decorator. All the cupcakes in town come to his barbershop to have their decorations styled."
TV Show,Bookaboo UK,2009,1 Season,Kids,"Bookaboo is a world famous rock puppy who tours the globe with his band, playing drums to packed stadiums of adoring fans. However, there's just one hitch for our rock puppy superstar - he can't play without a story a day!"
TV Show,Bookaboo,2016,1 Season,Kids,Bookaboo Season 1
TV Show,Boing: The Play Ranger,2016,2 Seasons,Kids,"Welcome to the village of Playville! A fun and colorful playground town filled with lovable characters that can transform into playground rides. Even in this world of happiness, unfortunate events happen from time to time. But don't you worry, our Play Rangers: Boing (Lion), Bing Bing (Hippo) and Mongbar (Monkey) are always here to keep the peace in the village so everyone can have fun."
TV Show,Bobby's World: The Complete Series,1990,7 Seasons,Kids,"Created by and starring Howie Mandel, this animated series takes a wild ride inside the mind of young Bobby Generic. Bobby is not your typical suburban kid. His active imagination takes viewers into a world of daring adventure, incredible wonder, and lots of laughs, all in a pint size perspective."
TV Show,Bo on the Go,2009,3 Seasons,Kids,"Bo is a positive, super-energetic and inquisitive young heroine who, along with her young friend Dezadore the dragon, encourages children at home to actively join her in a variety of movements that assist her on amazing adventures."
TV Show,Blippi - Videos for Kids,2016,1 Season,Kids,Blippi in this educational series for toddlers will teach your youngsters through the power of fun! Join Blippi at a few playgrounds and playing with some toys while keeping everything entertaining and educational at the same time!
TV Show,Blippi - Educational Videos for Children,2016,1 Season,Kids,"""Blippi"" is an educational children's show geared towards the ages of 2-6 years old. The fun and goofy host takes you for an adventure learning about exciting things like fire trucks, animals, garbage trucks, space, tractors and more while tying it into learning numbers, colors, shapes, words, and more!"
TV Show,Blippi - Educational Songs for Kids,2016,1 Season,Kids,"Blippi nursery rhymes for children has songs for kids like Tractors, Garbage Trucks, Fire Trucks, Backhoe Excavator, Trains, and more!"
TV Show,Bibi & Tina,2020,1 Season,Kids,"Bibi's summer vacation at her best friend Tina's start excitingly. Within no time the Martin's farm suffers from drought, rain, and a heavy storm. In addition to that, entrepreneur Kim Win Win wants to dig for gravel on their ranch. Bibi and Tina have to do something! Will the mysterious Spanish boy Chico help them? A turbulent summer awaits."
TV Show,Betsy's Kindergarten Adventures,2009,1 Season,Kids,"Told from the perspective of 5-year old Betsy, Betsy's Kindergarten Adventures is designed to ease a child's transition from the home setting to a school environment by generating interest and excitement about the kindergarten experience in young viewers."
TV Show,Best of BabyFirst Art Music Language And More,2019,4 Seasons,Kids,"Join us and all the friendly and fun faces of Baby First as you and your child go on a magical discovery of learning. You will see bright colors, learn about basic words, see animals and so much more."
TV Show,Berry and Dolly,2010,1 Season,Kids,"The animated series is set in a little forest with Berry, Dolly, and their forest and beetle friends. The two main characters are Berry the snail, and Dolly, the ladybird. The stories are based on children's everyday lives with love, loyalty and the respect of nature as the main messages."
TV Show,Barney,2009,10 Seasons,Kids,"Travel the world with Barney and his friends! The search is on for colorful eggs in Kenya, a music box in Switzerland, birds of paradise in Hawaii, and a dancing horse in Spain. Baby Bop brings her butterfly Monty to Mexico, while Barney introduces Rusty to China. And everyone puts on a show in Greece. Sing along to your favorite songs on this worldwide adventure with Barney and his friends."
TV Show,Barbie Dreamtopia (Spanish Audio),2018,1 Season,Kids,"Barbie and her little sister Chelsea travel through the whimsical worlds of Dreamtopia. Through the eyes of Chelsea's imagination, viewers explore delicious and delightful worlds and meet colorful characters who live there."
TV Show,Barbie Dreamtopia,2019,1 Season,Kids,"Join Barbie and Chelsea on magical adventures in Dreamtopia, as they transform into mermaids, fly over Sweetville with fairy bubble wings and take a ride on the back of the Elephant King of Sparkle Mountain."
TV Show,Barbie - Vlogger,2020,2 Seasons,Kids,"Hey everyone, welcome to my vlog! I share information about my life, my inspirations and my favourite things! I love to do silly challenges with my friends Ken, Harper, and Ryan, and my sister Chelsea. I hope these vlogs inspire you to be anything you want to be. Remember - Positive Attitude Changes Everything."
TV Show,Bananas in Pyjamas Live Action,1992,1 Season,Kids,"Bananas in Pyjamas is about two giant, child-like bananas, B1 and B2. They are good friends and companions. Together they live on Cuddles Lane, with their friends, the Teddy Bears: Amy, Morgan, and Lulu, the Rat-in-a-Hat, and various other critters. The bananas are constantly teasing the Teddy Bears, but those silly bananas are always able to foil the Rat's sly tricks."
TV Show,Bananas in Pyjamas,2013,2 Seasons,Kids,"Come down the stairs and join B1 and B2 in the second season of the beloved preschool series, featuring all new adventures in Cuddlestown. Together with their well-known friends: the teddies - Amy, Lulu and Morgan - Rat, as well as some new friends, our Bananas do what they love to do best: help each other, work together and have fun."
TV Show,Bali,2013,1 Season,Kids,"From PBS KIDS: Bali, a resolutely modern preschooler, lives a resolutely modern life in the big city."
TV Show,BabyBus - Super Rescue Team,2018,1 Season,Kids,"Super Rescue Team is one of the most popular animation series done by BabyBus. The episode focuses on the Super Rescue Team composed of baby panda Kiki, Miumiu, and their partners, whose mission is to build a beautiful home. Whenever the city is faced with various problems, they will use cool equipment to complete difficult tasks."
TV Show,Baby U Series,2015,1 Season,Kids,"Class is in session! Join BabyU for all the basic fundatmentals for your baby including language, counting, art exploration and more."
TV Show,Baby U (Spanish audio),2018,1 Season,Kids,"It's learning 101 for your little one! Join in and count from 1 to 5, learn about farm animals, and explore colors, too. Spanish audio."
TV Show,Avatar: The Last Airbender,2008,3 Seasons,Kids,Fire promises to be the most exciting season yet! Aang wakes up from his battle with Azula to discover that Ba Sing Se has fallen and the world thinks he's dead. So he and his friends set off undercover to find Firelord Ozai before the Day of Black Sun.
TV Show,Asawa Ko Karibal Ko,2019,1 Season,Kids,"Rachel meets Nathan, a gay man who later marries her due to family's pressure. Unhappy and trapped, Nathan plots his fake death and later undergoes to a sexual reassignment and face surgery in another country. Years later, Rachel meets Gavin and falls for him. Gavin has a wife, Venus whom Rachel will eventually find out to be her former husband."
TV Show,Arthur,2006,1 Season,Kids,"Welcome to ARTHUR and the adventures of the world's most famous aardvark, 8-year-old Arthur Read. Arthur and his Elwood City friends encounter the joys and difficulties that all kids experience, managing them with imagination, kindness, and a lot of humor! Based on the beloved best-selling books by Marc Brown."
TV Show,Annedroids,2017,4 Seasons,Kids,"Anne is back with friends Nick and Shania for more adventures and experiments with their android friends; Pal, Eyes, and Hand. This season the team bands together and uses scientific approaches to solve problems including: getting lost in the wilderness, dealing with a friend moving, building a robot for competition, and defending the junkyard from Ada's hostile takeover in an epic series finale."
TV Show,Animal Mechanicals,2011,2 Seasons,Kids,"Meet the Animal Mechanicals: Rex, Unicorn, Komodo, Sasquatch and Mouse. Animal Mechanicals is an action/adventure series for preschoolers that explores fantastic worlds, mythical animals and cool quests. And, best of all, Animal Mechanicals transform!"
TV Show,Angelina Ballerina Classic,2003,3 Seasons,Kids,"Join Angelina Ballerina and her friends as they go through the joys and frustrations of growing up as 'real life' is not a perfect ballet, and the steps are often hard and confusing."
TV Show,An American Girl Story,2017,3 Seasons,Kids,"Set in 1976 San Francisco, Ivy Ling second generation Chinese-American struggles to find balance between her two cultural identities. Though her parents value family and Chinese traditions, Ivy wishes to be like her all-American best friend, Julie Albright. When Ivy’s important gymnastics meet and her family’s Chinese New Year's dinner land on the same night, she has to decide between the two."
TV Show,Alien Monkeys,2015,1 Season,Kids,"Alien Monkeys is story about two monkeys exploring the world together with unexpected musical adventures. Oki is full of curiosity about everything on Earth and Taki is determined to find a bottle of ""Earth soda"". Surprisingly, they create fantastic musical performances while they are making trouble."
TV Show,Albert & Junior: Journey of discovery for babies,2015,1 Season,Kids,"Albert loves exploring the world around him! He has many questions about how things work, and always relies on his trusty buddy Junior to help explain the answers."
TV Show,ABC Galaxy (Spanish audio),2018,1 Season,Kids,"Travel the ABC Galaxy with Giggs & Hugg, two adorable friends. Spanish audio."
TV Show,Hot Wheels City,2020,1 Season,Kids,"In a world of wheels, all tracks lead to Hot Wheels City! Strap in with Chase and Elliot, two brothers who spend their days racing the streets in their favourite Hot Wheels. But when a mad scientist unleashes monstrous creations to destroy the city, Chase and Elliot shift into high gear to protect the citizens of Hot Wheels City. Do they have what it takes to save the day? Challenge Accepted!"
TV Show,Pastel Yumi: The Magic Idol,2020,1 Season,Kids,"After receiving a magical cane that makes any pictures she draws in the air real, Yumi uses her new powers to help those around her."
