type,title,release_year,duration,listed_in,description
TV Show,Pinkfong! Halloween Songs,2017,3 Seasons,Kids,"It's time to celebrate Halloween with ghosts and monsters. Let's sing and dance with monster friends! Meet Pinkfong's fun, educational videos that captured the hearts of millions of children around the world. Enjoy hundreds of kids' favorite songs and stories created by Pinkfong, the official creator of global hit Baby Shark behind #BabySharkChallenge."
TV Show,Pinkfong! Fun Rhyming Songs,2021,1 Season,Kids,Sing and learn new words with Pinkfong's rhyming songs! Are you ready to go on an adventure with Pinkfong? Repeat the words and dance to the rhythmic beats!
TV Show,Pinkfong! Fruit Songs,2021,1 Season,Kids,Welcome to Fruit World! Follow Pinkfong and friends to the healthy and juicy world of fruits and veggies. Sing with Pinkfong to learn more about fruits!
TV Show,Pinkfong! Dinosaur Songs (Spanish Version),2014,1 Season,Kids,"Shake it! Shake it! Sing and move your body with awesome dinosaurs and learn their names. Meet Pinkfong's fun, educational videos that captured the hearts of millions of children around the world. Enjoy hundreds of kids' favorite songs and stories created by Pinkfong, the official creator of global hit Baby Shark behind #BabySharkChallenge."
TV Show,Pinkfong! Dinosaur Musical Stories,2017,2 Seasons,Kids,"A collection of musical stories about kids' favorite dinosaurs. Stomp around with the ferocious T-Rex, fly with our chatty friend Pteranodon and much more. This collection of musical stories combines familiar tunes with entertaining stories to cater to all the curious little explorers."
TV Show,Pinkfong! Coloring with Hogi,2020,2 Seasons,Kids,Let's color our Wonderstar friends! Coloring with Hogi is a special series where kids can follow along and color with their favorite characters! What color would you choose?
TV Show,Pinkfong! Christmas Carols,2018,2 Seasons,Kids,"Merry Christmas! Let's celebrate the holiday with festive Christmas carols! Meet Pinkfong's fun, educational videos that captured the hearts of millions of children around the world. Enjoy hundreds of kids' favorite songs and stories created by Pinkfong, the official creator of global hit Baby Shark behind #BabySharkChallenge."
TV Show,Pinkfong! Car Songs (Spanish Version),2014,1 Season,Kids,"Sing along to fun children's songs and learn the names of various vehicles. Meet Pinkfong's fun, educational videos that captured the hearts of millions of children around the world. Enjoy hundreds of kids' favorite songs and stories created by Pinkfong, the official creator of global hit Baby Shark behind #BabySharkChallenge."
TV Show,Pinkfong! Car Songs,2016,2 Seasons,Kids,"Sing along to fun children's songs and learn the names of various vehicles. Meet Pinkfong's fun, educational videos that captured the hearts of millions of children around the world. Enjoy hundreds of kids' favorite songs and stories created by Pinkfong, the official creator of global hit Baby Shark behind #BabySharkChallenge."
TV Show,Pinkfong! Body Songs,2017,1 Season,Kids,"It's time to move your body and learn about different body parts. Meet Pinkfong's fun, educational videos that captured the hearts of millions of children around the world. Enjoy hundreds of kids' favorite songs and stories created by Pinkfong, the official creator of global hit Baby Shark behind #BabySharkChallenge."
TV Show,Pinkfong! Best Kids Songs,2012,2 Seasons,Kids,"Sing, dance and play to kids' favorite nursery rhymes! Meet Pinkfong's fun, educational videos that captured the hearts of millions of children around the world. Enjoy hundreds of kids' favorite songs and stories created by Pinkfong, the official creator of global hit Baby Shark behind #BabySharkChallenge."
TV Show,Pinkfong! Bedtime Lullabies,2015,1 Season,Kids,"It's time to go to bed with bedtime lullabies. Listen to all time favorite lullabies that soothe your little ones! Meet Pinkfong's fun, educational videos that captured the hearts of millions of children around the world. Enjoy hundreds of kids' favorite songs and stories created by Pinkfong, the official creator of global hit Baby Shark behind #BabySharkChallenge."
TV Show,Pinkfong! Baby Shark's Day at Home,2021,1 Season,Kids,"How does Baby Shark's day look like at home? From getting up and brushing his teeth to going to bed, in this series you will be able to follow Baby Shark in his adventures all day!"
TV Show,Pinkfong! Baby Shark Special (Spanish Version),2017,1 Season,Kids,"Enjoy a collection of ""Baby Shark"" songs. Meet Pinkfong's fun, educational videos that captured the hearts of millions of children around the world. Enjoy hundreds of kids' favorite songs and stories created by Pinkfong, the official creator of global hit Baby Shark behind #BabySharkChallenge."
TV Show,Pinkfong! Baby Shark Special,2017,1 Season,Kids,"Enjoy a collection of Baby Shark Special Songs. Meet Pinkfong's fun, educational videos that captured the hearts of millions of children around the world. Enjoy hundreds of kids' favorite songs and stories created by Pinkfong, the official creator of global hit Baby Shark behind #BabySharkChallenge."
TV Show,Pinkfong! Baby Shark Sing Along,2019,3 Seasons,Kids,"Ready for another underwater adventure? Come along with us for another sing-along spectacular with Baby Shark! From mermaid watching to Easter egg hunting, there is so much in store for this next chapter of our favorite sing-along songs."
TV Show,Pinkfong! Baby Shark Nursery Rhymes,2019,1 Season,Kids,"Are you ready, shark friends? Baby Shark needs your help! Have you seen Baby Shark's teeth? Together we can find them and meet some new sea friends along the way! Let's dive into a new adventure! Come explore with us!"
TV Show,Pinkfong! Baby Shark & More Animal Songs (Spanish Version),2016,1 Season,Kids,"Baby shark, doo, doo, doo, doo, doo, doo. Baby shark! Meet Pinkfong's fun, educational videos that captured the hearts of millions of children around the world. Enjoy hundreds of kids' favorite songs and stories created by educational experts."
TV Show,Pinkfong! Baby Shark & Halloween Songs,2020,2 Seasons,Kids,"Happy Halloween, shark friends! Ready for some trick or treating? Lets get celebrate the Day of the Dead by getting spooky with Baby Shark! Boo!"
TV Show,Pinkfong! Baby Shark & Christmas Songs,2020,1 Season,Kids,Baby Shark & Christmas Songs brings a joyful collection of holiday tunes for children of all ages to sing and dance during this Christmas time! Slide into the wintery season with Pinkfong & Baby Shark!
TV Show,Pingu,2005,6 Seasons,Kids,"Go fishing with Pingu! Catch up with this cool penguin as he drives a snowmobile, goes to Sled Academy, pogos up and down, and meets the Abominable Snowman!"
TV Show,Phonics School,2017,1 Season,Kids,Phonics School is a fun series introducing children to phonics - method by which children are taught to read and write. Phonikers are no ordinary letters! They all possess a natural power to transform into anything beginning with their sound and change back by tracing their shape. Phonikers are like any other children; some spend their time avoiding trouble whilst others positively look for it.
TV Show,Peppa Pig,2011,2 Seasons,Kids,"Peppa is a loveable, cheeky little piggy who lives with her little brother George, Mummy Pig and Daddy Pig. Peppa's favorite things include playing games, dressing up, days out and jumping in muddy puddles."
TV Show,Peg + Cat,2013,1 Season,Kids,"From PBS KIDS and The Fred Rogers Company, Peg and Cat's adventures take them through worlds of infinite possibilities – from farms to purple planets, from 16th-century Verona to New York's Radio City Music Hall, from a land of pirates to a prehistoric valley – demonstrating that math is everywhere."
TV Show,Peep Time,2020,1 Season,Kids,"The story follows Shinichi Toneli (Shingo Katori), a clumsy resident of Apt. 301 whose unexpected behavior amuses his neighbor in Apt. 302, Jiro Kasuya (Jiro Sato), who peeps through a hole. The story starts when Jiro's daughter Akane (Chihiro Yamamoto) finds out about her dad's hobby and she joins him peeping through a hole..."
TV Show,PEEP and the Big Wide World,2011,1 Season,Kids,"Set in and around a pond, a bush, and a tin can, PEEP and the Big Wide Worldfollows a newly hatched chicken named Peep, and his friends Chirp and Quack (a robin and a duck), on their daily adventures."
TV Show,Peekaboo I See You Series,2015,1 Season,Kids,"The game of peek-a-boo has entertained babies and toddlers alike for years and years! In ""Peekaboo, I See You!"", the friendly blue fellow swings, rolls, bounces, summersaults and tiptoes into the hearts of little ones. Each episode features three objects and viewers get to guess which one he's hiding behind. The series is sure to result in giggles and surprises."
TV Show,Parry Gripp Video Mega-Party,2012,1 Season,Kids,"Raining Tacos, Space Unicorns, and more. Sing-a-long with this Parry Gripp video-fest!"
TV Show,Pajanimals,2012,1 Season,Kids,"Pajanimals is a musical series that centers on a quartet of cuddly critters who use stories and songs to explore their feelings and frustrations about bedtime. With the help of these adorable lovies, preschoolers will come to see that there's no shame in facing worries like being afraid of the dark or anxious about separating from a parent."
TV Show,Owlegories,2017,1 Season,Kids,"Follow along as Joey, Nora, Violet, Gus, & Twitch learn about faith, God, and the Bible through the amazing things found in nature. Episodes include topics on The Sun, The Seed, The Water, The Ant, The Fruit, The Butterfly, The Fire, The Duck, The Seasons, The Gift, The Star, The Lion, The Lamb, The Bread, The Wind, The Moon, and The Rainbow."
TV Show,Oddbods,2020,2 Seasons,Kids,Oddbods is an award winning animated series that follows the comedic adventures of seven adorable yet quirky characters. Every episode celebrates the 'odd' in everything where seemingly ordinary situations are given a humorous twist and everyone has fun along the way.
TV Show,Odd Squad,2014,1 Season,Kids,"Odd Squad, a live-action media property designed to help kids ages 5-8 learn math. The show focuses on two young agents, Olive and Otto, who are part of the Odd Squad, an agency whose mission is to save the day whenever something unusual happens in their town."
TV Show,Nursery Ryhmes for Babies,2019,2 Seasons,Kids,"Enjoy classic nursery rhymes with your baby or toddler all set to beautiful, colorful imagery and catchy music."
TV Show,Nursery Rhymes with Color Crew (Spanish audio),2018,1 Season,Kids,"Join us for a color song special collection in 3D animation, featuring all the colors nursery rhymes from the infamous color crew"
TV Show,Nursery Rhymes and Kids Songs by KiiYii (Made by Little Baby Bum),2019,5 Seasons,Kids,"A new collection of colorful and wonderfully engaging nursery rhymes and children's songs that will thrill your child while educating them in their numbers, ABCs, and general learning! From the creators of LittleBabyBum, KiiYii allows the child's imagination to go further!"
TV Show,Numbers Parade Series,2015,1 Season,Kids,"Introduce your baby to numbers one all the way through five in this upbeat and educational series. You'll go on a journey with BabyFirst as you meet a variety of friends along the way including Peep, the chick from Numbers Farm, and all the adorable animals from Numbers Around the Globe."
TV Show,Niko and the Sword of Light,2019,3 Seasons,Kids,"The Dark Champion pursues Niko, Lyra, and their friends as they race to find the Amulet of Power before Nar Est and their foes. They journey across the land, under the sea, and beyond the realm of the living, where Niko seeks to discover his true purpose… and a way to rid the world of Darkness once and for all."
TV Show,New Words with Joey's Toy Box Series,2015,1 Season,Kids,"Meet Joey and his mom on advenures where they explore common words and objects that can be found in your home, backyard and more!"
TV Show,Nature Cat,2016,1 Season,Kids,"NATURE CAT is an animated series that follows Fred, a house cat who dreams of exploring the great outdoors. Once his family leaves for the day, Fred transforms into Nature Cat, an outdoor explorer extraordinaire. With the help of his animal friends, Nature Cat embarks on action-packed adventures all while inspiring children to go outside."
TV Show,Music and Sounds with Bonnie Bear Series,2015,1 Season,Kids,"Together with her best friend, Mr. Gramophone, Bonnie Bear creates colorful paintings from sounds that she hears. ""Bonnie Bear"" demonstrates how working with both your ears and hands can bring together sounds and colors to create a beautiful, whole picture."
TV Show,"Mr. Monkey, Monkey Mechanic",2019,3 Seasons,Kids,"Mr. Monkey, Monkey Mechanic is here to help fix any vehicle a visitor brings! From food trucks and tractors, to bumper cars and even scooters, when Mr. Monkey gets his Monkey wrench, he'll find a creative and fun way to get all his animal friends moving again!"
TV Show,Mr. Bean: The Animated Series,2019,1 Season,Kids,"This series follows Mr Bean, his best friend Teddy and his long-suffering landlady Mrs Wicket as we witness more of the mishaps that surround Mr Bean's daily life."
TV Show,Mr. Bean,1995,1 Season,Kids,"Life is a difficult challenge for Mr Bean, who despite being a grown adult, has trouble completing even the simplest of tasks. Thankfully, his perseverance is usually rewarded, and he finds an ingenious way around the problem. British sitcom created by Rowan Atkinson and Richard Curtis, and starring Atkinson as the title character."
TV Show,Mr Bean in Handy Bean,2018,1 Season,Kids,"Mr Bean cooks, creates, packs and paints in this new series. From chocolate on pizza to painting the mono-brow Lisa - sorry, we mean the Mona Lisa! Watch Bean bumble through three bean salads (not what you're thinking) and birthday cakes (his own, obviously)... what could possibly go wrong?"
TV Show,Mother Goose Stories,1992,1 Season,Kids,"This delightful Emmy-award winning series, directed by Brian Henson, takes a light-hearted look at familiar nursery rhymes. Each eight-minute episode features Mother Goose, who shares these nursery rhymes with her three impatient, fluffy goslings. Episodes combine the live-action talents of young children with Jim Henson's extraordinary puppets."
TV Show,Monster High Adventures of the Ghoul Squad,2017,1 Season,Kids,"Draculaura, Frankie, Clawdeen, and their ghoulfriends combine their wits and monsteriffic abilities as they travel to exotic locations, solve spine-tingling mysteries, and rescue monsters who are hiding from a world that fears and doesn't understand them. So how do you track these missing monsters down and bring them back to their new home at Monster High? You call The Ghoul Squad!"
TV Show,Momo Storytime,2015,1 Season,Kids,Listen to wonderful Children's stories and tales that entertain and educate at the same time.
TV Show,Momo Shake it Up,2014,1 Season,Kids,"Join fellow kids as they dance, play and excercise to fun and exciting Chinese games and songs."
TV Show,Momo Plays an Instrument,2016,1 Season,Kids,Learn about different musical instruments.
TV Show,Momo Plays a Matching Game,2014,2 Seasons,Kids,Momo learns new things by playing a matching game.
TV Show,Momo Meets Animals,2014,1 Season,Kids,Learn about different animals in a fun and entertaining way to build up your kids Chinese knowledge.
TV Show,Momo Loves to Sing and Dance,2016,2 Seasons,Kids,Momo and friends have fun singing and dancing to hapyy music!
TV Show,Momo Loves to Sing,2016,2 Seasons,Kids,Join in the fun and dance with your friends. Learn fun new Chinese songs
TV Show,Momo Loves to Dance,2015,2 Seasons,Kids,Join in the fun - dance and excercise to happy and playful songs.
TV Show,Momo Let's Play Together,2015,3 Seasons,Kids,Watch and join in with kids playing fun and educational games
TV Show,Momo Learns to Write,2014,2 Seasons,Kids,Learn to write traditional Chinese words in a fun way for Kids.
TV Show,Momo Learns to be Polite,2014,1 Season,Kids,"See and learn from examples of good, well-mannered behavior from different people and in different circumstances."
TV Show,Mix Master: King of Cards,2005,1 Season,Kids,"Mix Master: King of Cards - In the Mix Master animated series, the everyday town of Gamebridge has mixed up with a magical game world. Peculiar monsters known as Hench are running wild, and an evil Prince is plotting world conquest. The folks of Gamebridge must turn to an unlikely hero, Ditt, an 11 year old slacker who will become the Mix Master and save the world."
TV Show,Mix Master: Final Force,2011,1 Season,Kids,"After becoming the legendary Mix Master, Ditt now leads a boring, normal life as a student. But when the fantasy world faces another crisis, Ditt must join with other Mix Masters who are called upon to battle evil forces. The evil villain, Root, is determined to destroy both the Real World and the Fantasy World and create a new world of his own."
TV Show,Mister Maker,2007,1 Season,Kids,"Mister Maker is an arts and craft show that combines live action, graphics and animation to show brilliant art techniques in both 2D and 3D! A child's entertainment show that teaches you numerous easy arts and crafts for anybody watching. Let's get making!"
TV Show,Martha Speaks,2010,1 Season,Kids,Learn new words with Martha and her friends!
TV Show,Lost In Oz,2018,2 Seasons,Kids,"13 new episodes of the multi-Emmy Award-Winning series LOST IN OZ take Dorothy, Toto, and their friends to new, magical, and perilous lands, as well as some surprisingly familiar worlds. They'll make new friends, face new enemies, and reunite with loved ones from Emerald City and beyond!"
TV Show,Looped,2016,2 Seasons,Kids,"Ever wish you had a RE-DO button, or knew you were having a pop-quiz before it popped?"
TV Show,LoliRock,2017,2 Seasons,Kids,A teenager with a beautiful voice becomes a pop star but discovers she has powers that come from a magical realm where she's a lost princess.
TV Show,LOL Surprise! Winter Disco,2019,1 Season,Kids,"Tahani and Mykal-Michelle are stuck inside their house during a snowstorm with no lights or internet! So, Tahani tells a story that takes us into the world of LOL Surprise, where everyone is preparing for the coolest party ever: The Winter Disco! When Midnight is the only B.B. not invited to perform at The Chalet, she embarks on a journey to sabotage the party, and change the Winter Disco forever!"
TV Show,Little Big Awesome,2018,2 Seasons,Kids,"Little Big Awesome follows Gluko and Lennon, the two best friends ever of all time in the history of everything.  While having weird and wonderful adventures around Townopolis, these besties help the citizens live their best lives, even if helping sometimes causes more problems than it solves."
TV Show,Let's Learn Chinese,2017,1 Season,Kids,Learn simple words in Chinese and English
TV Show,Leo The Wildlife Ranger,2015,1 Season,Kids,Join Junior Rangers Leo and Katie and their loyal companion Hero on adventures with exotic animals from all over the world!
TV Show,LEGO City Adventures,2019,1 Season,Kids,"LEGO® City Adventures is a brand new character-driven series, presenting funny, smart, kinetic slices of city life that explore the hopes, dreams, goals, stories - and adventures"
TV Show,Learn with Ted The Train,2017,1 Season,Kids,"Ted the Train is a good friend of Dino the Dinosaur and Ethan the Dumpt Truck. Learn the colors, the numbers or the shapes with Ted the Train. It is better to learn with fun!! That is why Ted is here!!"
TV Show,Kung Fu Panda: The Paws of Destiny,2019,2 Seasons,Kids,"Now famously known as the Four Constellations the panda kids are summoned by the Emperor to the Forbidden City, making Po fear the kids might not need his teachings anymore. But when friends turn to foes, all our heroes will need to draw from their Chi and all their Kung Fu knowledge to defeat evil in an explosive and epic battle."
TV Show,Kung Food,2011,1 Season,Kids,"Come aboard the Steamer, a magical ship with a lovable crew of chefs, from brave Bao and Choi to lazy Mr. Twi, on a high-seas adventure! From crime-fighting Sushi men, to mighty Electric Eels, to magical castles in the sky, the ""Kung Food"" gang is heading off on a trip of fun and laughs that you'll never forget!"
TV Show,Kratts' Creatures,1996,1 Season,Kids,"Brothers Martin and Chris Kratt mix wildlife documentary, creative animation and humorous dialogue to present a program about all kinds of wild creatures. They are assisted at their research center by nature enthusiast Allison, and a wise-cracking, animated cartoon friend named Ttark."
TV Show,Kaijudo: Rise of the Duel Masters,2013,1 Season,Kids,"Kaijudo is an animated series that follows the adventures of a young hero, Ray, who possesses the ability to befriend and duel alongside fantastical creatures from a parallel dimension. Ray must join the ranks of the mysterious Duel Masters and master the ancient art of Kaijudo to ensure the survival of both races before it is too late."
TV Show,Just Add Magic: Mystery City,2020,1 Season,Kids,"In this spinoff of the successful series JUST ADD MAGIC, we follow the magic cookbook to Bay City as it moves to three new protectors: step-siblings Zoe and Leo, and their upstairs neighbor Ish. Each of the three brings a unique skill to the table, as the cookbook unlocks a centuries-old mystery that takes them on an historical adventure through the city streets in a race to find a secret recipe."
TV Show,Just Add Magic,2019,5 Seasons,Kids,"The Magic Cookbook has appeared in a new town with new protectors! Kelly, Darbie, and Hannah must now travel to Bay City to train the new trio on how to handle the recipes and the dangerous downsides. What they find is that the new protectors aren't even friends let alone ready to trust and use magic."
TV Show,Jingle Burgers - A Parry Gripp Christmas Album,2020,1 Season,Kids,Sing-a-long with these super fun Christmas songs from Parry Gripp!
TV Show,Jim Henson's The Storyteller: Greek Myths,1991,1 Season,Kids,"This spin-off series features a new Storyteller, who finds himself trapped with his dog in the ruins of an ancient labyrinth. As he wanders deeper into the maze, he discovers artifacts in the rubble, each with a remarkable myth behind it. Now digitally remastered!"
TV Show,Jim Henson's The Storyteller,1989,1 Season,Kids,"This beautifully realized, BAFTA-award winning anthology series features human actors alongside creations from Jim Henson's Creature Shop in retellings of classic folk tales, fables, and legends from all over the world. Aided by his cynical dog, The Storyteller (performed by renowned actor John Hurt) narrates fascinating tales that combine humor, intrigue, and magic. Now digitally remastered!"
TV Show,Jelly Jam,2011,1 Season,Kids,"Join Bello and his Jelly Jamm friends as they share exciting adventures on their home planet of Jammbo, where music is born. Laugh and learn with these magical friends as they use fun and creativity to face their fears, solve everyday problems and learn to live together in happiness and harmony."
TV Show,Insectibles,2016,1 Season,Kids,"Insectibles follows the adventures of a young boy named Zak, his inventor Grandfather and 3 mechanically enhanced insects as they embark on an epic search to find pieces of the broken Shrinkinator while evading their enemies!"
TV Show,How 2,1990,1 Season,Kids,"How 2 is a world-famous children's programme dedicated to science and general trivia. Originally aired in 1966 under the title How, TVS brought it back to life in 1990. Though the name was changed, the format stayed the same: Three presenters sit around a table, and ask rhetorical questions"
TV Show,Horrid Henry,2014,3 Seasons,Kids,"Ever get the feeling that life just isn't fair? Henry gets that feeling, all of the time. Of course he's only a kid, but with a perfect little brother called Peter, a Mum and Dad who'd love him dearly if only he'd stop behaving, well, like a kid, and a moody girl next door who's on a mission to make Henry's life miserable, who can blame him?"
TV Show,Horrible Science,2015,1 Season,Kids,"The first ever series based on the well known books of the same name published by Scholastic. Originally produced for CiTV, ABC and Discovery and now available exclusively to Amazon Prime. Horrible Science is a spoof of a TV science show with behind the scenes and shiny floor drama starring Ben Miller."
TV Show,H2O: Just Add Water,2010,3 Seasons,Kids,"Rikki, Cleo and Lewis think they know everything there is to know about Mako Island, but when water attacks the girls in a full moon, they realize a new, potentially dangerous force is developing on the mysterious island. Thankfully they find an ally in Bella, a new girl in town who reveals an equally surprising twist; she too is a mermaid with extraordinary super powers."
TV Show,Guess How Much I Love You,2015,1 Season,Kids,"In Guess How Much I Love You Season 2, Little Nutbrown Hare and his father, Big Nutbrown Hare, romp through another 26 charming adventures. Everyone's favorite characters return: fun-loving Little Field Mouse, mischievous Little Grey Squirrel and tricky Little Redwood Fox are back, as well as Little White Owl with her tales of mystery."
TV Show,Guardians of the Power Masks,2010,1 Season,Kids,"Something quite unexpected happens when Annie is forced to spend the summer with her aging, warrior grandmother in the sleepy rural town of Singing Rocks, China. It doesn't take long for Annie and her cousin Yong to find out that their grandmother is the keeper of three secret and powerful masks that will guide them in their quest to be the next generation of warriors to help save the world."
