type,title,release_year,duration,listed_in,description
TV Show,Zoo Babies,2008,1 Season,Kids,"A heart warming and inspiring series that welcomes the arrival of new members of the animal kingdom in Zoo's around the world, as well as showcasing endangered species being born in captivity, 'Zoo Babies' is perfect family viewing packaged with fun, colourful graphics designed to capture the attention of little ones."
TV Show,Zoboomafoo,2001,1 Season,Kids,Chris and Martin Kratt bring their enthusiasm for animals to the pre-school set.
TV Show,Yu-Gi-Oh! 5D's,2011,2 Seasons,Kids,"With the defeat of Director Goodwin and the Dark Signers, New Domino City's barriers have been torn down. City and Satellite are now one - united in the hope of building a brighter tomorrow. Yet in this time of renaissance and rebuilding, a new enemy emerges, and Yusei and his friends must rev it up in order to save the world – one duel at a time."
TV Show,Xiaolin Chronicles,2015,1 Season,Kids,"Newcomer Ping Pong joins the legendary Xiaolin Monks: Omi, Kimiko, Raimundo, and Clay for fantastical new adventures! Leading the dark forces is Heylin Dragon Chase, who vows to revenge against Xiaolin. Throwing a monkey's wrench into the mix is supervillain wannabe Jack Spicer. Under the tutelage of an evil witch, Jack and his robot army are gunning for the Shen Gong Wu for world domination."
TV Show,WordWorld,2007,1 Season,Kids,The loveable WordFriends take children on adventures in a world of words where they encounter all sorts of situations that can only be solved by building a word!
TV Show,WordGirl,2010,1 Season,Kids,WordGirl and her sidekick Captain Huggy Face take down quirky villains in every action-packed episode.
TV Show,Wonder Balls,2015,1 Season,Kids,"Enjoy parades of unique and fun ball characters! Wonder Balls bring the best performances to the stage. When they meet, they start playing right away. Brush Ball, Sponge Ball, Water Ball, Accordion Ball, Castanets Ball, Xylophone Ball and more join to complete stories of vivacious arts, exciting music and joyful play."
TV Show,Wishenpoof,2019,4 Seasons,Kids,"Bianca is just like any other little girl, except for one teensy little thing.  Bianca has Wish Magic, so she can make wishes come true! Whether she’s at home in Wish World, at the Willow Tree with her fairy friends, or at school with her non-fairy friends, Bianca and her hilarious teddy bear sidekick Bob navigate day-to-day problems."
TV Show,Wild Kratts,2011,1 Season,Kids,"The real-life Chris and Martin introduce each Wild Kratts episode with a live action segment that imagines what it would be like to experience a never- before-seen wildlife moment, and asks, ""What if...?"" The Kratt brothers transition into animation and the adventure begins, bringing early-elementary school children into the secret lives of extraordinary creatures, many of which have never been animated before - including proboscis monkeys, draco lizards and caracals!"
TV Show,Wendy,2016,1 Season,Kids,"The series focuses on Wendy and the extraordinary life she leads in her equestrian-centric world. At 15, she's already an accomplished show-jumper. Lucky for her, she lives at Rose Valley - the stables and riding school owned and operated by her father - where there are always plenty of horses and drama galore!"
TV Show,WellieWishers,2017,2 Seasons,Kids,"Join the WellieWishers™ as they imagine, sing, dream and discover just what it takes to be kind. When the WellieWishers step into their colorful garden boots, they’re ready for anything – stomping in muddy puddles, dancing with fireflies and navigating the ins and outs of friendship through play and imagination."
TV Show,Wallace & Gromit's Cracking Contraptions,2002,1 Season,Kids,"With multiple Academy Awards under their belt, Wallace and Gromit are one the of the best-loved comic double-acts in the world. Fans of their TV specials and feature films will not want to miss these rarely-seen short films, each of which introduces a new invention from Wallace intended to make everyday life a little easier such as the Autochef, the Soccamatic, and the Snoozatron. Predictably enough, these mini-masterpieces never perform quite as expected, and it is down to Wallace's long-suffering dog Gromit to pick up the pieces."
TV Show,Wallace & Gromit: The Complete Collection,2008,1 Season,Kids,"Academy Award winning eccentric inventor Wallace, and his faithful, four-legged friend Gromit have specially re-mastered all four of their smashing half-hour specials."
TV Show,TuTu Town,2014,1 Season,Kids,Join Andy and his friends as they experience life in TuTu Town! Fun and exciting adventures await the viewer as the characters explore themes of friendship and civic mindedness.
TV Show,Tumble Leaf,2019,6 Seasons,Kids,"Tumble Leaf is a series aimed at preschoolers, set in a whimsical land where a small blue fox named Fig plays each day and discovers adventure, friendship and love around every bend in the path. Children will be enriched by narratives that promote play, the fun of learning and understanding the world around them."
TV Show,Troy the Train,2019,2 Seasons,Kids,"Troy the train is the fastest and smartest train in Train Town! He can transform himself in any vehicles with the help of his friend, Teddy ! Every day, Troy the train meets new friends, who follow him in wonderful adventures."
TV Show,Travel with Kids,2015,2 Seasons,Kids,"Travel With Kids adventure continues from Bora Bora to Botswana. Learn history and culture in California and China. Swim with whale sharks in Mexico, explore the jungles of Belize and get castaway on Fiji. Enjoy Hawaii head out on safari in South Africa. Travel With Kids brings you educational and trip planning, or just trip dreaming fun for the family!"
TV Show,Totally Spies!,2014,6 Seasons,Kids,"Join Sam, Alex and Clover, high school best friends, as they accidentally find their way into their secret lives of being undercover spies for WOOHP, who fight and foil the devious plans of the world's strangest and the most outrageous supervillains. Each episode gives us a sneak peek into their lives and serves as a reminder that some super spies have high school woes and homework!"
TV Show,Tom's Paint Shop,2019,2 Seasons,Kids,"Tom the Tow Truck, the famous truck of Car City, is also fond of painting ! Tom welcomes his truck friends into his brand new Paint Shop and transforms them into their favorite character. Tom The Tow Truck can paint anything that comes from his friends' imagination. Welcome to Tom's Paint Shop !"
TV Show,Tom the Tow Truck of Car City,2019,4 Seasons,Kids,"Tom the Tow truck is an ingenious mechanic who is always there to help his friends. When accidents happen in Car City and vehicles get broken, Tom rushes to get them into his garage in order to repair them. Follow him in his important mission!"
TV Show,ToddWorld,2005,2 Seasons,Kids,"Based on Todd Parr's acclaimed children's books, ToddWorld is a celebration of imagination in a world where everyone is welcome! In ToddWorld, it's okay to wear your underpants on your head, take a bath with a hippo or invite a skunk to the movies. It's a wonderful colorful world - come join in the fun!"
TV Show,Toca Life Stories,2020,1 Season,Kids,Will Zeke be able to pet Ok Street's tiiiiniest animal? Does Leon overcome his stage fright? Will Rita escape Octobox's awkwardness? And where in the world does Nari disappear to? Follow the gang and their quest to vanquish boredom in Toca Life Stories season 1.
TV Show,Tiny Trucks,2020,2 Seasons,Kids,"Charlie the Crane, Billy the Bulldozer and Ed the Excavator are the ingenious Tiny Trucks. Those small but clever construction trucks assemble pieces of funny trucks and attractions. Ice cream trucks, giant slides, fire trucks, and so more. Learn and have fun with the Tiny Trucks."
TV Show,Timmy Time,2011,5 Seasons,Kids,It's Christmas Eve at the Timmy Time Nursery.
TV Show,Thunderbirds Are Go,2018,4 Seasons,Kids,"The Hood and The Mechanic have escaped and are once again wreaking havoc, but they have different plans. IR must work to thwart these masterminds while protecting those in need, such as oil rig deckhand (Emilia Clarke) and eccentric inventor (David Tennant). In the end, both villains resurface for a jaw-dropping battle, one that will test the Thunderbirds like never before."
TV Show,Thomas & Friends S22 (US),2019,1 Season,Kids,"In 'Big World! Big Adventures!' the series, Thomas continues on his railway adventures around the world. In a newly-formatted and fast-paced series, Thomas meets new railway friends in China, India, and Australia, as well as a new Steam Team on the familiar Island of Sodor. So jump on board to join Thomas & Friends on their brand-new whirlwind adventure!"
TV Show,Thomas & Friends Classic,2003,7 Seasons,Kids,"Watch these track stars! Percy gets it right, as Gordon steams over Spencer. Salty saves the day, while Thomas deserves a medal. Join in the adventure and fun with Thomas and Friends."
TV Show,The Wubbulous World of Dr. Seuss,1997,2 Seasons,Kids,"This Emmy-nominated series features the fun, music and adventures of some of the favorite characters created by Theodore Geisel (aka Dr. Seuss). Starring The Cat In the Hat, The Grinch, his dog Max, Terrence, Horton, Yertle and all the residents of Seussville, these whimsical tales and characters come to life using masterful puppets built by Jim Henson's Creature Shop and 3D computer animation."
TV Show,The Stinky & Dirty Show,2019,5 Seasons,Kids,"Best friends Stinky the garbage truck and Dirty the backhoe loader return for more resourcefulness and whimsical adventures – all inspired by using what’s around them and asking the question: “What if…?” Based on books by Jim and Kate McMullan with original music from Dan Bern and featuring celebrity voices like Whoopi Goldberg, Jane Lynch, Andy Richter, Joan Cusack and Wallace Shawn."
TV Show,The Snowy Day,2016,1 Season,Kids,"Based on the award-winning book by Ezra Jack Keats. Peter goes on a magical, snowy walk to his Nana's house to bring home their Christmas Eve dinner."
TV Show,The Prince Family,2020,1 Season,Kids,Welcome to season 3! The Prince Family is all about family-friendly videos you can share with your kids!
TV Show,The Notekins - Musical Friends,2015,1 Season,Kids,"Step into the magical world of music in ""The Notekins"" Featuring seven little people representing each a musical note. The Notekins are invited to visit different musical instruments and along the way the young viewers will be introduced to basic musical concepts such as pitch and tempo. ""The Notekins"" is sure to have your toddler singing and dancing"
TV Show,The Kicks,2016,1 Season,Kids,"Devin Burke and her family have moved cross-country to California and now must adjust to a new life and a new soccer team. The Kentville Kicks don't quite play up to the standard that Devin is used to, so she must establish herself as a leader while also trying to make friends in a strange place."
TV Show,The Great British Benefits Handout,2017,2 Seasons,Kids,"Three unemployed families are given a cash lump sum of 26,000 pounds in return for signing off."
TV Show,The Garfield Show,2020,4 Seasons,Kids,"A lasagne-loving cat adventures and explores the differences between good and bad, and right and wrong. Join the adventure !"
TV Show,The Dick Van Dyke Show,1963,1 Season,Kids,"Rob Petrie is the head writer for the television sketch comedy, the Alan Brady Show. Rob must balance his New York City work life with his New Rochelle home life that includes his wife, Laura, and their son, Ritchie. Although content in her roles as housewife and mother, on occasion, Laura aspires to return to her former life as a dancer."
TV Show,The DaVincibles,2014,1 Season,Kids,"This zany cartoon comedy series is packed with funny and absurd characters in search of wild, slapstick action. 16-year-old Pablo DaVinci and his 15-year-old sister Zoe struggle to put aside their sibling rivalry as they travel the world with their crazy yet loveable Uncle Leo in search of rare and sometimes valuable artifacts to sell at Leo's Kurious Kat antique shop."
TV Show,The Beverly Hillbillies,1963,1 Season,Kids,"The Clampett family are simple folk, happily living off the land in the Ozarks. They want for nothing and ask for nothing. When Jed Clampett accidentally discovers oil on his family's property, they strike it rich, becoming millionaires. With their newfound wealth, the Clampetts decide to enter a new life... in Beverly Hills, California."
TV Show,The Best of Mister Rogers' Neighborhood,1975,1 Season,Kids,"MISTER ROGERS' NEIGHBORHOOD is more than a television program - it's a visit with a trusted friend and guide, exploring with children things that matter in their everyday world - feelings, questions and concerns."
TV Show,The Bernie Mac Show,2006,5 Seasons,Kids,A stand up comedian suddenly becomes a father when he takes custody of his sister's three children.
TV Show,The Adventures of Tintin,2019,3 Seasons,Kids,"The show tells the story of a young Belgian reporter named Tintin, and all the dangerous, exciting and humorous adventures he has all over the world."
TV Show,Tenkai Knights,2014,1 Season,Kids,"Teens from earth Guren, Ceylan, Toxsa, and Chooki find an interdimensional portal to Quarton where they are chosen by the Guardians to become the new generation of Tenkai Knights and prevent Vilius to take control of both worlds."
TV Show,Telmo and Tula: Volume 3,2016,1 Season,Kids,Join Telmo and Tula for more fun-filled adventures in the world of cooking and crafts!
TV Show,Team Umizoomi,2012,3 Seasons,Kids,"Team Umizoomi, Season 3 is here and that's Umirrific news! The team needs your help to put a toy dinosaur back together, use math skills to count numbers on the clock face, and lots more. Plus, meet friends including Wyatt, the Cuckoo Bears and Amanda!"
TV Show,Tayo the Little Bus,2019,5 Seasons,Kids,"""Tayo the Little Bus"" is about exciting adventures that are to happen in the metropolitan city where different vehicles live with harmony with one another. Tayo is just starting to learn his route in this busy city centre and on his journey, he is making many new friends. Full of unique characters that capture children's imaginations and fun story lines, the series has a lot to offer."
TV Show,Superbook,2015,3 Seasons,Kids,Chris Quantum is your typical Middle School student – except if you take into account one of his best friends is a robot named Gizmo. Add his best friend Joy Pepper into the mix and you have a recipe for adventure. The adventures begin for this trio when a mysterious device appears and takes them on journeys throughout the Bible. Travel back in time and get ready for the journey of a lifetime!
TV Show,Sunny Bunnies,2018,2 Seasons,Kids,"Our little fluffy-eared friends Sunny Bunnies like keeping themselves busy and continue to do so in Season 3: they discover the world of magic, getting sporty, constructing things, growing plants, explore different cultures and even race the Wolf in their little racing cars!"
TV Show,SpongeBob SquarePants,2009,6 Seasons,Kids,"Who lives in a pineapple under the sea? SpongeBob SquarePants! Follow the adventures of this enthusiastic, optimistic sponge whose good intentions inevitably lead him and his friends into trouble."
TV Show,SpongeBob DocuPants,2020,1 Season,Kids,"Imagine classic SpongeBob moments being told through the lens of documentary shows like E! True Hollywood Stories, Dateline, Behind the Music etc. Each episode takes an overly dramatic look into classic SpongeBob storylines."
TV Show,Sonic X,2005,3 Seasons,Kids,"Sonic, his friends, and the evil Dr. Eggman are sucked into a warp! They find themselves in the human world where Sonic finds a new friend, a young boy named Chris. Sonic speeds through battles with Eggman, trying to retrieve all of the Chaos Emeralds so that everyone can go back home!"
TV Show,Sing-Along-Songs For Kids,2013,1 Season,Kids,"This colorful and engaging children's program features songs, music, animations and sing-along to entertain and educate your kids. SING-ALONG-SONGS FOR KIDS includes timeless English nursery rhymes as well as modern-day classics and educational sing-alongs."
TV Show,Simon's Cat - Classic Collection,2018,1 Season,Kids,"Simon's Cat - Classic Collection features all eighty-five black and white episodes from the hugely popular YouTube channel. Thematically curated in to extended episodes, this Classic Collection will make you smile like a Cheshire Cat!"
TV Show,Sigmund and the Sea Monsters,2017,1 Season,Kids,"Brothers Johnny and Scotty find Sigmund, a sea monster, on the beach and bring him home to their clubhouse. They become fast friends, but when a monster hunter, Capt. Barnabas (David Arquette), finds out, the kids have to scramble to keep Sigmund hidden. Worse still, Sigmund's brothers Blurp and Slurp don't like humans. Against all odds, can they still have an endless summer of fun?"
TV Show,Sid the Science Kid,2008,1 Season,Kids,"Season 1 Volume 1. Sid the Science Kid is an award-winning educational animated television series that uses comedy and music to promote exploration, discovery and science readiness among pre-schoolers."
TV Show,SHK HeroForce,2018,1 Season,Kids,"While Noah, Hope, and Eden are moving out of their old house, they discover a hidden virtual reality gaming console in the attic that acts as a portal between the game HeroForce and Real Life. The kids must find and protect the power rings from the hands of the evil bosses that have crossed into Real Life in search of the rings."
TV Show,Shaun the Sheep - The Farmer's Llamas,2015,1 Season,Kids,"When the Farmer and Bitzer go to a Country Fair, Shaun steals away with them intent on causing mischief. Shaun spies an auction where he sees three exotic and very crafty Llamas going under the hammer. Instantly besotted by their fantastic pranks Shaun cleverly gets the unwitting Farmer to Buy them."
TV Show,SciGirls,2010,1 Season,Kids,"From PBS - In the first season of SciGirls, the girls, with the help of scientist mentors, design their own inquiry-based investigations on a huge variety of topics, from the environment to technology and from engineering to nutrition."
TV Show,Scaredy Squirrel,2012,4 Seasons,Kids,"Based on a series of children's books written by Mélanie Watt, this animated series features Scaredy, a creative, offbeat squirrel who is learning to be comfortable in his own fur. Scaredy tackles every challenge that is thrown at him with his trademark dorkiness, but he has a self-confidence that makes him cool."
TV Show,Rubbadubbers,2005,4 Seasons,Kids,"Arr! Arr! Arr! The Rubbadubbers are having a splashing good time making wishes, hunting monsters, playing sports, meeting ghosts, and painting the sky."
TV Show,"Ronja, the Robber's Daughter",2017,1 Season,Kids,"Presented by Studio Ghibli. The daughter of a professional robber, Ronja realizes the complicated nature of her father's profession when she befriends Birk, the child of a rival tribe. She struggles to balance this friendship with her family relationship but comes to understand, differences can be overcome with the help of love and understanding."
TV Show,Rolie Polie Olie,1998,1 Season,Kids,"This amazing CG-animated series depicts the hilarious childhood of Olie, a young robot who lives in a magical, futuristic, all-robot world of blue skies and happy, helpful machines - where virtually everything from baby carriages to spaceships comes to life."
TV Show,Rocky and Bullwinkle,2019,2 Seasons,Kids,"The world-famous talking moose and flying squirrel are back in The Adventures of Rocky and Bullwinkle, a comedy about two goofball friends who end up in harrowing situations but end up saving the day time and again. As their silly ambitions dovetail with Fearless Leader's sinister plans to take over the world, they are set on a collision course with his notorious super spies Boris and Natasha."
TV Show,Rev & Roll,2019,1 Season,Kids,"Join 8-year-old Rev and his best friend, Rumble-a rambunctious, powerful truck with a puppy personality! Whether they're helping around town or roaring through the wilderness, Rev, Rumble and their friends are always ready to rev and roll!"
TV Show,Redakai: Lokar's Shadow,2013,1 Season,Kids,"Ky, a 15-year old student of ancient martial arts, embarks on an epic quest to find the Kairu, a primordial alien energy source. Aided by his friends Maya and Boomer, Ky travels the world searching for the Kairu while attempting to make sure that his extraterrestrial teenage alien adversaries don't find it first."
TV Show,Ready Jet Go!,2016,1 Season,Kids,"READY JET GO! takes viewers on a journey into outer space, building on children's curiosity about science, technology and astronomy. The series follows two neighborhood kids: Sean and Sydney. They both befriend the new kid on their street, Jet Propulsion, whose family members happen to be aliens from the planet Bortron 7."
TV Show,Reading Rainbow,1997,2 Seasons,Kids,"Take a look, it’s in a book, a Reading Rainbow! For over 30 years, this beloved children’s television series has been bringing stories to life. Hosted by acclaimed actor LeVar Burton, journey to exciting places and build a lasting connection with your favorite books – but you don’t have to take our word for it."
TV Show,Reading Egg's The Eggsperts,2014,1 Season,Kids,"Sam, Jazz and Tom live in the quirky village of Eggleston and are brilliant when it comes to hatching clues and eggs. These lovable characters take young children on fun-filled adventures to amazing lands on their quest to find clues, hatch eggs and meet a new friend in every episode. The Eggsperts is a series that inspires play with the use of sounds, rhyming word play and fun."
TV Show,Rainbow Ruby,2016,1 Season,Kids,"Rainbow Ruby comes to the rescue whenever a doll friend needs help! When Choco's heart starts to glow, she knows it's time for a magical journey into Rainbow Village. With the help of her enchanted suitcase, the ""Rainbow Roller"", Rainbow Ruby takes on helping roles with enthusiasm and confidence!"
TV Show,Postcards from Buster,2012,1 Season,Kids,"Buster Baxter of ""Arthur"" fame travels around the world with his family."
TV Show,Pokémon the Series: Gold and Silver,2001,4 Seasons,Kids,"Leaving Pallet Town behind them, Ash, Pikachu, Misty, and Brock are back on the road and heading for their next challenge: the Johto region!"
TV Show,Pocket.watch Onyx Family Ultimate mishmash,2020,1 Season,Kids,"Onyx Family, popular vloggers best known for their silly and spooky skits, stars in the brand new series, pocket.watch Onyx Family Ultimate mishmash! Enjoy the scary but comedic scenarios cooked up by siblings Shiloh, Shasha, Sinead, and Shalom-AKA Onyx Kids-along with Onyx Mom and Onyx Dad, Rita and Mirthell, on the ultimate family-friendly entertainment adventure."
TV Show,Plim Plim,2015,1 Season,Kids,"From amazing robots to magical words, delicious pizza to special kingdoms, Plim Plim is an animated series for all ages! Plim and his friends learn life lessons and make the world a better place together, one adventure at a time."
TV Show,Pinkfong! Wash Your Hands With Baby Shark,2020,1 Season,Kids,"Join the #BabySharkHandWashChallenge now! Follow the hand-washing steps along with the Baby Shark tune, and keep your hands nice & clean! Let's doo doo doo doo it together!"
TV Show,Pinkfong! Times Tables Songs,2014,1 Season,Kids,"Learn your multiplication tables with Pinkfong! Meet Pinkfong's fun, educational videos that captured the hearts of millions of children around the world. Enjoy hundreds of kids' favorite songs and stories created by Pinkfong, the official creator of global hit Baby Shark behind #BabySharkChallenge."
TV Show,Pinkfong! Time Songs,2017,1 Season,Kids,"Tick-tock, what time is it? Let's sing and learn how to tell time. Meet Pinkfong's fun, educational videos that captured the hearts of millions of children around the world. Enjoy hundreds of kids' favorite songs and stories created by Pinkfong, the official creator of global hit Baby Shark behind #BabySharkChallenge."
TV Show,Pinkfong! Shape Songs,2015,1 Season,Kids,"Learn different shapes by singing along to Pinkfong Shape Songs! Meet Pinkfong's fun, educational videos that captured the hearts of millions of children around the world. Enjoy hundreds of kids' favorite songs and stories created by Pinkfong, the official creator of global hit Baby Shark behind #BabySharkChallenge."
TV Show,Pinkfong! Poki's Toy Lab,2021,1 Season,Kids,Hi friends! Welcome to the genius inventor Poki's Toy Lab. What is Poki going to create today?
TV Show,Pinkfong! Outer Space Songs,2021,2 Seasons,Kids,Follow along Pinkfong's journey to outer space! Learn about the eight planets in our solar system and more. Let's fly with Pinkfong and catch a glimpse of all these different planets!
TV Show,Pinkfong! Number Songs,2015,2 Seasons,Kids,"Sing along to fun children's songs and develop an understanding of numbers and counting skills while having fun. Meet Pinkfong's fun, educational videos that captured the hearts of millions of children around the world. Enjoy hundreds of kids' favorite songs and stories created by Pinkfong, the official creator of global hit Baby Shark behind #BabySharkChallenge."
TV Show,Pinkfong! Learn Colors with Hogi,2021,2 Seasons,Kids,Learn the colors of the rainbow with Hogi and friends! Wonderville is full of colorful characters. Follow Hogi and explore Wonderville!
TV Show,"Pinkfong! Hogi, the Detective",2021,1 Season,Kids,"Hogi is the best detective in Wonderville! With Hogi's extraordinary powers of observation, there's no case he cannot solve! Let's follow Hogi and the Wonderstar friends in their detective adventures!"
