type,title,release_year,duration,listed_in,description
TV Show,The Homecoming,2015,1 Season,Reality TV,"Panelists from the Korean show ""Abnormal Summit"" lead cast mates on tours of their home countries, including China, Nepal, Italy, Canada and France."
TV Show,The House That Made Me,2015,3 Seasons,Reality TV,"With host Vinay Pathak, Indian celebrities return to their childhood homes to reconnect with the past and share stories of their journey to success."
TV Show,The Kindness Diaries,2019,1 Season,Reality TV,"Host Leon Logothetis travels the world with only a vintage motorbike and the kindness of strangers, which he pays back in unexpected, inspiring ways."
TV Show,The Rap Game,2016,1 Season,Reality TV,Young lyricists between the ages of 12 and 16 compete for a chance to sign to Jermaine Dupri's label while being mentored by hip-hop and R&B's finest.
TV Show,The Twilight Zone (Original Series),1963,4 Seasons,TV Sci-Fi & Fantasy,"Hosted by creator Rod Serling, this groundbreaking anthology series presents tales of the supernatural that are often tinged with social commentary."
TV Show,ThirTEEN Terrors,2014,1 Season,TV Horror,A group of teens searches for the dark truth behind their school's mysterious and brutal history.
TV Show,Top Grier,2018,3 Seasons,Reality TV,"Social media star Hayes Grier returns to North Carolina for a reality series packed with action sports, pranks and romantic escapades."
TV Show,Towies,2016,1 Season,Reality TV,Australia's toughest tow truck operators work to keep Queensland's streets clear of overturned semis and other automotive disasters.
TV Show,Winsanity,2016,1 Season,Reality TV,Actor Donald Faison hosts this game show in which contestants must arrange numerical-based trivia tidbits from largest to smallest for various prizes.
