type,title,release_year,duration,listed_in,description
TV Show,Queen of the South,2018,4 Seasons,Crime TV Shows,"Forced to work for a cartel that recently killed her boyfriend, Teresa relies on her street smarts, a loyal pal and a mysterious notebook to survive."
TV Show,13 Reasons Why,2020,4 Seasons,Crime TV Shows,"After a teenage girl's perplexing suicide, a classmate receives a series of tapes that unravel the mystery of her tragic choice."
TV Show,Inhuman Resources,2020,1 Season,Crime TV Shows,"Alain Delambre, unemployed and 57, is lured by an attractive job opening. But things get ugly when he realizes he’s a pawn in a cruel corporate game."
TV Show,Sleepless Society: Two Pillows & A Lost Soul,2020,1 Season,Crime TV Shows,A motivational speaker about to divorce her abusive husband wakes up from a wild party one morning to find a dead body.
TV Show,Strangers from Hell,2019,1 Season,TV Horror,Unpleasant events disturb the life of an aspiring crime fiction writer when he becomes a resident of an apartment building teeming with shady neighbors.
TV Show,White Lines,2020,1 Season,Crime TV Shows,"Zoe Walker leaves her quiet life behind to investigate her brother's disappearance in Ibiza, where she quickly heads down a decadent and dangerous path."
TV Show,Bordertown,2019,3 Seasons,Crime TV Shows,A gifted detective takes a job in a small town so he can spend more time with his family. But he's soon drawn into a web of disturbing murder cases.
TV Show,Trial By Media,2020,1 Season,Crime TV Shows,"In this true crime docuseries, some of the most dramatic trials of all time are examined with an emphasis on how the media may have impacted verdicts."
TV Show,Reckoning,2019,1 Season,Crime TV Shows,"When a local teen is murdered in their quiet, suburban community, two fathers intent on protecting their families must contend with their inner demons."
TV Show,El señor de los Cielos,2019,7 Seasons,Crime TV Shows,Only Aurelio Casillas can fill Pablo Escobar's shoes and become Mexico's biggest drug trafficker of the '90s.
TV Show,The Forest of Love: Deep Cut,2020,1 Season,Crime TV Shows,Nothing's as it seems when a charismatic conman and an aspiring film crew delve into the lives of two emotionally scarred women.
TV Show,The Victims' Game,2020,1 Season,Crime TV Shows,"After discovering his estranged daughter's link to mysterious murders, a forensic detective with Asperger's syndrome risks everything to solve the case."
TV Show,Extracurricular,2020,1 Season,Crime TV Shows,A model high school student who's steeped in a world of serious crime finds his double life upended when a classmate takes an interest in his secret.
TV Show,Nicky Jam: El Ganador,2018,1 Season,Crime TV Shows,Follow reggaeton artist Nicky Jam's struggles to overcome drug addiction and rise to international success in this dramatization of his life story.
TV Show,The King: Eternal Monarch,2020,1 Season,Crime TV Shows,"A modern-day Korean emperor passes through a mysterious portal and into a parallel world, where he encounters a feisty police detective."
TV Show,El Dragón: Return of a Warrior,2020,2 Seasons,Crime TV Shows,"To replace his grandfather as head of a cartel, a Tokyo financier returns to his home country of Mexico, where he must battle two rivals for control."
TV Show,Hasmukh,2020,1 Season,Crime TV Shows,"A timid, small-town comedian's long-awaited big break takes a dark turn when he realizes committing murder is the only way to keep his onstage mojo."
TV Show,Fauda,2020,3 Seasons,Crime TV Shows,"A top Israeli agent comes out of retirement to hunt for a Palestinian militant he thought he'd killed, setting a chaotic chain of events into motion."
TV Show,The Innocence Files,2020,1 Season,Crime TV Shows,"The Innocence Project unravels missteps and deceit in a series of wrongful convictions, exposing the injustice inflicted on victims and the accused."
TV Show,The Trial,2019,1 Season,Crime TV Shows,"The murder of a teen girl impacts a public prosecutor linked to the victim, a lawyer seeking a career-making case and a suspect who says she's innocent."
TV Show,How to Fix a Drug Scandal,2020,1 Season,Crime TV Shows,"Two drug lab chemists' shocking crimes cripple a state's judicial system and blur the lines of justice for lawyers, officials and thousands of inmates."
TV Show,Rugal,2020,1 Season,Crime TV Shows,A police detective who loses everything to a criminal organization seeks payback when he gains special abilities through biotechnology.
TV Show,Happy!,2019,2 Seasons,Crime TV Shows,A boozy ex-cop turned hit man thinks he's losing his marbles when a cartoon unicorn only he can see urges him to rescue a girl kidnapped by Santa.
TV Show,Ozark,2020,3 Seasons,Crime TV Shows,"A financial adviser drags his family from Chicago to the Missouri Ozarks, where he must launder $500 million in five years to appease a drug boss."
TV Show,Freud,2020,1 Season,Crime TV Shows,"Eager to make his name in 19th-century Vienna, a hungry young Sigmund Freud joins a psychic and an inspector to solve a string of bloody mysteries."
TV Show,She,2020,1 Season,Crime TV Shows,An undercover assignment to expose a drug ring becomes a timid Mumbai constable’s road to empowerment as she realizes her dormant sexuality's potential.
TV Show,"Tiger King: Murder, Mayhem and Madness",2020,1 Season,Crime TV Shows,A zoo owner spirals out of control amid a cast of eccentric characters in this true murder-for-hire story from the underworld of big cat breeding.
TV Show,Women Of The Night,2019,1 Season,Crime TV Shows,"Haunted by a shadowy past, the wife of a rising star in Amsterdam's mayoral office finds herself drawn into the city’s underworld of sex and drugs."
TV Show,Bloodride,2020,1 Season,TV Horror,"The doomed passengers aboard a spectral bus head toward a gruesome, unknown destination in this deliciously macabre horror anthology series."
TV Show,The Valhalla Murders,2020,1 Season,Crime TV Shows,An Oslo detective with a painful past returns to his native Iceland to help a dedicated cop hunt a serial killer with a link to a mysterious photo.
TV Show,Dirty Money,2020,2 Seasons,Crime TV Shows,"From crippling payday loans to cars that cheat emissions tests, this investigative series exposes brazen acts of corporate greed and corruption."
TV Show,Babylon Berlin,2020,3 Seasons,Crime TV Shows,A Soviet freight train's hijacking leads a haunted cop and a poor typist to uncover a political conspiracy amid the vice and glamour of 1929 Berlin.
TV Show,Toy Boy,2019,1 Season,Crime TV Shows,"After seven years in a Málaga prison, a male stripper is released pending retrial and sets out to prove his lover framed him for her husband's murder."
TV Show,Altered Carbon,2020,2 Seasons,Crime TV Shows,"After 250 years on ice, a prisoner returns to life in a new body with one chance to win his freedom: by solving a mind-bending murder."
TV Show,The Trials of Gabriel Fernandez,2020,1 Season,Crime TV Shows,A boy’s brutal murder and the public trials of his guardians and social workers prompt questions about the system’s protection of vulnerable children.
TV Show,Unabomber - In His Own Words,2018,1 Season,Crime TV Shows,"The CIA attempts to turn Ted Kaczynski, aka the Unabomber, into a super agent — a plan that backfires. Based on real events."
TV Show,Puerta 7,2020,1 Season,Crime TV Shows,A determined woman works to rid an Argentine soccer club of the violent crime and corruption surrounding its intense fanbase.
TV Show,Spectros,2020,1 Season,TV Horror,A group of teens get caught up in a supernatural clash as vengeful spirits from centuries past rise up in the Liberdade district of São Paulo.
TV Show,Narcos: Mexico,2020,2 Seasons,Crime TV Shows,"Witness the birth of the Mexican drug war in the 1980s as a gritty new ""Narcos"" saga chronicles the true story of the Guadalajara cartel's ascent."
TV Show,Sleepless Society: Insomnia,2019,1 Season,Crime TV Shows,"Haunted by recurring visions, a young woman with insomnia visits an old home to solve a mystery and put her nightmares to an end."
TV Show,Better Call Saul,2018,4 Seasons,Crime TV Shows,"This Emmy-nominated prequel to ""Breaking Bad"" follows small-time attorney Jimmy McGill as he transforms into morally challenged lawyer Saul Goodman."
TV Show,Who Killed Malcolm X?,2020,1 Season,Crime TV Shows,"Decades after the assassination of African American leader Malcolm X, an activist embarks on a complex mission seeking truth in the name of justice."
TV Show,Arrow,2019,8 Seasons,Crime TV Shows,"Based on DC Comics' Green Arrow, an affluent playboy becomes a vengeful superhero, saving the city from villains armed with just a bow and arrows."
TV Show,The Pharmacist,2020,1 Season,Crime TV Shows,"After his son's tragic death, a Louisiana pharmacist goes to extremes to expose the rampant corruption behind the opioid addiction crisis."
TV Show,Unauthorized Living,2020,2 Seasons,Crime TV Shows,"When a Galician shipper and drug lord hiding his Alzheimer's disease plans to retire, his second-in-command plots to steal the empire from the heir."
TV Show,THE STRANGER,2020,1 Season,Crime TV Shows,"When a stranger makes a shocking claim about his wife, family man Adam Price becomes entangled in a mystery as he desperately searches for answers."
TV Show,Killer Inside: The Mind of Aaron Hernandez,2020,1 Season,Crime TV Shows,"Via interviews with friends, players and insiders, this docuseries examines how Aaron Hernandez went from an NFL star to a convicted killer."
TV Show,Giri / Haji,2019,1 Season,Crime TV Shows,Family duty sends a lawman to London to look for his mob-assassin brother as a yakuza war threatens to engulf Tokyo. Trust is even tougher to find.
TV Show,Jamtara - Sabka Number Ayega,2020,1 Season,Crime TV Shows,"A group of small-town young men run a lucrative phishing operation, until a corrupt politician wants in on their scheme – and a cop wants to fight it."
TV Show,Medical Police,2020,1 Season,Crime TV Shows,Doctors Owen Maestro and Lola Spratt leave Childrens Hospital and join a secret arm of the CDC to investigate and destroy a deadly global virus.
TV Show,Border Security: America's Front Line,2018,1 Season,Crime TV Shows,This reality series chronicles the behind-the-scenes action as U.S. Customs and Border Protection agents safeguard the nation's crossings and ports.
TV Show,"Nisman: The Prosecutor, the President, and the Spy",2020,1 Season,Crime TV Shows,"This docuseries details the suspicious death of Alberto Nisman, investigator of the 1994 bombing of the Argentine Israelite Mutual Association building."
TV Show,You,2019,2 Seasons,Crime TV Shows,"Obsessed with an aspiring writer, a charming bookstore manager goes to extreme measures to insert himself into her life."
TV Show,Ultraviolet,2019,2 Seasons,Crime TV Shows,An online community of amateur sleuths use technology to solve crimes – and make quirky friends – in their quest for justice.
TV Show,Don't F**k with Cats: Hunting an Internet Killer,2019,1 Season,Crime TV Shows,A twisted criminal's gruesome videos drive a group of amateur online sleuths to launch a risky manhunt that pulls them into a dark underworld.
TV Show,The Confession Killer,2019,1 Season,Crime TV Shows,Henry Lee Lucas rose to infamy when he confessed to hundreds of unsolved murders. This docuseries examines the truth – and horrifying consequences.
TV Show,Triad Princess,2019,1 Season,Crime TV Shows,"After jostling her way into a gig as a celebrity bodyguard, the boisterous daughter of a powerful triad boss shakes up a TV star's life and finds love."
TV Show,Nightflyers,2018,1 Season,TV Horror,"With humankind's future at stake, a group of scientists and a powerful telepath venture into the void aboard a spaceship full of secrets."
TV Show,La Reina del Sur,2019,2 Seasons,Crime TV Shows,"This compelling show tells the story of the legendary Teresa Mendoza, a courageous woman who is perceived as conquering the world of drug trafficking."
TV Show,The Crime,2015,2 Seasons,Crime TV Shows,The peaceful lives of the residents inhabiting a breathtaking seaside town are shaken following a series of macabre crimes.
TV Show,Narcoworld: Dope Stories,2019,1 Season,Crime TV Shows,"Ride along as police officers and drug smugglers go toe-to-toe, trying to outwit each other in locales around the world."
TV Show,Who Killed Little Gregory?,2019,1 Season,Crime TV Shows,"When their 4-year-old son is murdered, a young couple fights a twisting and arduous battle trying to identify a frustratingly elusive killer."
TV Show,The Club,2019,1 Season,Crime TV Shows,"A band of misfit rich kids in Mexico strike out on their own selling MDMA and quickly run into trouble with other narcos, the law and their families."
TV Show,The Yard,2019,2 Seasons,Crime TV Shows,"After a fateful domestic clash, a devoted mother finds herself in prison and fighting to survive in hopes of reuniting with her daughter."
TV Show,Wild District,2019,2 Seasons,Crime TV Shows,"After surrendering to Bogotá police, an ex-guerrilla avoids prison by working undercover to investigate a ruthless enforcer of government corruption."
TV Show,SCAMS,2019,1 Season,Crime TV Shows,"Hit hard by the Lehman shock, a well-meaning young man joins a phone scam operation and gets increasingly embroiled in the underworld."
TV Show,The Devil Next Door,2019,1 Season,Crime TV Shows,"A Cleveland grandfather is brought to trial in Israel, accused of being the infamous Nazi death camp guard known as Ivan the Terrible."
TV Show,Ad Vitam,2018,1 Season,Crime TV Shows,"In a future where regeneration technology lets humans live indefinitely, a cop and a troubled young woman investigate a strange wave of youth suicides."
TV Show,Nowhere Man,2019,1 Season,Crime TV Shows,"Two nefarious schemes taking place 10 years apart entangle a dauntless triad member, who must break out of prison to rescue a loved one."
TV Show,Sleepless Society: Bedtime Wishes,2019,1 Season,Crime TV Shows,"During a holiday stay at a hotel resort, a flight attendant encounters a wealthy, mysterious man with two different personas."
TV Show,Tunnel,2019,1 Season,Crime TV Shows,A detective finds himself 30 years in the future and must solve a string of grisly crimes before he can return to the past.
TV Show,Brotherhood,2019,1 Season,Crime TV Shows,"An honest lawyer reaches a moral crossroads after the cops force her to inform on her incarcerated brother, the leader of a rising criminal faction."
TV Show,Drug Squad: Costa del Sol,2019,1 Season,Crime TV Shows,Four intrepid and impulsive police officers form a special narcotics unit to combat the birth of drug trafficking on Spain's Costa del Sol in the 1970s.
TV Show,Monzón: A Knockout Blow,2018,1 Season,Crime TV Shows,"This dramatization tells the story of Argentine boxing champion Carlos Monzón, as well as the investigation into the death of his wife Alicia Muñiz."
TV Show,Chosen,2019,2 Seasons,Crime TV Shows,"When a mysterious box arrives at his door, a doctor and father is forced to participate in a twisted killing game, or risk losing everything."
TV Show,Black Money Love,2014,1 Season,Crime TV Shows,"After a cop's fiancée and a jewelry designer's father are found dead together, the two bereaved ones face a perilous aftermath of a theft gone wrong."
TV Show,The Lies Within,2019,1 Season,Crime TV Shows,"After her father dies and her husband goes missing, Kim Seo-hui teams up with detective Jo Tae-sik and joins the National Assembly."
TV Show,Peaky Blinders,2019,5 Seasons,Crime TV Shows,"A notorious gang in 1919 Birmingham, England, is led by the fierce Tommy Shelby, a crime boss set on moving up in the world no matter the cost."
TV Show,Gotham,2019,5 Seasons,Crime TV Shows,"Long before he was commissioner, rookie cop James Gordon takes on Gotham City crime and corruption to avenge the murder of Bruce Wayne's parents."
TV Show,El Marginal,2019,3 Seasons,Crime TV Shows,"While investigating a kidnapping, an ex-cop sent to infiltrate a prison finds himself surrounded by dangerous felons who can't know his real identity."
TV Show,The Inmate,2018,1 Season,Crime TV Shows,A former Marine poses as an inmate inside a Mexican prison in order to infiltrate a gang suspected of kidnapping a U.S. judge's teen daughter.
TV Show,Criminal: France,2019,1 Season,Crime TV Shows,"Secrets emerge and entire cases unravel inside a police interview room in Paris, where suspects and investigators face off in an intricate dance."
TV Show,Criminal: Germany,2019,1 Season,Crime TV Shows,"In the interview room, detectives go head-to-head with suspects and try to get to the truth – even if it means breaking the rules and risking it all."
TV Show,Criminal: Spain,2019,1 Season,Crime TV Shows,"Psychological games abound between detectives and suspects in a tense interrogation room, where the search for answers sometimes comes at a moral cost."
TV Show,Surviving R. Kelly,2019,1 Season,Crime TV Shows,"In this documentary series on the tangled history of allegations against musician R. Kelly, women give detailed accounts of sexual and mental abuse."
TV Show,Top Boy,2019,1 Season,Crime TV Shows,"Two seasoned drug dealers return to the gritty streets of London, but their pursuit of money and power is threatened by a young and ruthless hustler."
TV Show,Unbelievable,2019,1 Season,Crime TV Shows,"After a young woman is accused of lying about a rape, two female detectives investigate a spate of eerily similar attacks. Inspired by true events."
TV Show,Serial Killer with Piers Morgan,2018,1 Season,Crime TV Shows,"Through intense prison interviews, Piers Morgan revisits the crimes of three convicted serial killers and learns more about their motives."
TV Show,The Good Bandit,2018,1 Season,Crime TV Shows,"A near-death experience spurs a feared drug lord to leave behind his life of crime and infidelity, to the disbelief of everyone close to him."
TV Show,13 Reasons Why: Beyond the Reasons,2019,3 Seasons,Crime TV Shows,"Cast members, writers, producers and mental health professionals discuss some of the difficult issues and themes explored in ""13 Reasons Why."""
TV Show,Apache: The Life of Carlos Tevez,2019,1 Season,Crime TV Shows,This gritty dramatization of the life of Carlos Tevez shows his rise to soccer stardom amid the harrowing conditions in Argentina's Fuerte Apache.
TV Show,Better Than Us,2019,1 Season,Crime TV Shows,"A family on the brink of splitting up become the owners of a cutting-edge robot being sought by a corporation, homicide investigators and terrorists."
TV Show,Green Frontier,2019,1 Season,Crime TV Shows,"When a young Bogotá-based detective gets drawn into the jungle to investigate four femicides, she uncovers magic, an evil plot and her own true origins."
TV Show,MINDHUNTER,2019,2 Seasons,Crime TV Shows,In the late 1970s two FBI agents expand criminal science by delving into the psychology of murder and getting uneasily close to all-too-real monsters.
TV Show,Sacred Games,2019,2 Seasons,Crime TV Shows,"A link in their pasts leads an honest cop to a fugitive gang boss, whose cryptic warning spurs the officer on a quest to save Mumbai from cataclysm."
TV Show,Happy Jail,2019,1 Season,Crime TV Shows,"The Philippine jail known for a viral Michael Jackson dance video comes under the management of an ex-convict, sparking controversy and criticism."
TV Show,Sintonia,2019,1 Season,Crime TV Shows,"Three teens living in the same São Paulo favela pursue their dreams while maintaining their friendship, amid a world of music, drugs and religion."
TV Show,Bad Guys,2014,1 Season,Crime TV Shows,"Reinstated to eradicate the worst crimes in the city, a detective requests the release of three convicts to enlist their help in catching the felons."
TV Show,Typewriter,2019,1 Season,TV Horror,"Three young friends in Goa plan to search an old villa for ghosts, but when a new family moves in, the home’s buried past resurfaces in chilling ways."
TV Show,Stranger Things,2019,3 Seasons,TV Horror,"When a young boy vanishes, a small town uncovers a mystery involving secret experiments, terrifying supernatural forces and one strange little girl."
TV Show,Dope,2019,3 Seasons,Crime TV Shows,"Filmed from the perspectives of dealers, users and the police, this vivid series offers a bracing look at the war on drugs."
TV Show,Exhibit A,2019,1 Season,Crime TV Shows,This true crime series shows how innocent people have been convicted with dubious forensic techniques and tools such as touch DNA and cadaver dogs.
TV Show,Answer for Heaven,2019,1 Season,Crime TV Shows,An angel falls to earth to investigate why humans are doing fewer good deeds – and falls in with a hard-charging crime reporter and his news team.
TV Show,Shooter,2018,3 Seasons,Crime TV Shows,"A highly decorated ex-Marine sniper returns to action to foil an assassination plot targeting the president, but soon finds himself framed for murder."
TV Show,The Confession Tapes,2019,2 Seasons,Crime TV Shows,"This true crime documentary series investigates cases where people convicted of murder claim their confessions were coerced, involuntary or false."
TV Show,The Alcàsser Murders,2019,1 Season,Crime TV Shows,New interviews and an up-to-date analysis of evidence shed light on the 1992 murders of three girls in Spain and their profound impact on the nation.
TV Show,Unit 42,2017,1 Season,Crime TV Shows,A widowed cop tapped to lead a special cybercrimes unit teams up with a former hacker to hunt down tech-savvy criminals who are terrorizing Belgium.
TV Show,Black Spot,2019,2 Seasons,Crime TV Shows,A police chief and an eccentric new prosecutor investigate a string of grisly crimes and eerie phenomena in an isolated town at the edge of a forest.
TV Show,El desconocido,2019,2 Seasons,Crime TV Shows,"Based on real events, the fictional story of Mexican drug lord El Chato's number one hitman, El Cholo."
TV Show,Marvel's Jessica Jones,2019,3 Seasons,Crime TV Shows,"Haunted by a traumatic past, Jessica Jones uses her gifts as a private eye to find her tormentor before he can harm anyone else in Hell's Kitchen."
TV Show,Yankee,2019,1 Season,Crime TV Shows,"On the run from the police, an Arizona man crosses into Mexico and gets deeply involved in drug trafficking – with the help of modern technology."
TV Show,Designated Survivor,2019,3 Seasons,Crime TV Shows,America's fate rests in the hands of a low-level official after an attack on Washington decimates the government in this gripping political thriller.
TV Show,Bad Blood,2019,2 Seasons,Crime TV Shows,"This sprawling crime drama follows the true story of the Rizzuto family and its associates, who presided over organized crime in Montreal for decades."
TV Show,Killer Ratings,2019,1 Season,Crime TV Shows,Brazilian TV personality and politician Wallace Souza faces accusations of masterminding the violent crimes he reported on and rallied against.
TV Show,When They See Us,2019,1 Season,Crime TV Shows,Five teens from Harlem become trapped in a nightmare when they're falsely accused of a brutal attack in Central Park. Based on the true story.
TV Show,Rosario Tijeras,2018,2 Seasons,Crime TV Shows,Worlds collide when a vengeance-obsessed young woman from the other side of the tracks captures the attention of two well-off friends.
TV Show,1994,2019,1 Season,Crime TV Shows,"Archival video and new interviews examine Mexican politics in 1994, a year marked by the rise of the EZLN and the assassination of Luis Donaldo Colosio."
TV Show,The Defected,2019,1 Season,Crime TV Shows,"After surviving a near-fatal injury on the job, a cop sets out to investigate a conspiracy involving the top brass of the police department."
TV Show,The Mechanism,2019,2 Seasons,Crime TV Shows,A scandal erupts in Brazil during an investigation of alleged government corruption via oil and construction companies. Loosely inspired by true events.
TV Show,Abyss,2019,1 Season,Crime TV Shows,"After meeting an untimely demise in separate incidents, Cha Min and Go Se-yeon discover they’ve come back to life in new bodies they don’t recognize."
TV Show,The Writer,2019,1 Season,Crime TV Shows,"When accused of a murder eerily parallel to a plot in his novel, a best-selling crime writer must navigate a web of hidden enemies."
TV Show,Crime Diaries: Night Out,2019,1 Season,Crime TV Shows,"After going to a Halloween party, college student Luis Andrés Colmenares is found dead. Was it an accident or murder? Inspired by true events."
TV Show,The Outsiders,2004,1 Season,Crime TV Shows,A trio of delinquent brothers fends off neighborhood rivals until one joins a gang to gain protection for the upper-class girl he loves.
TV Show,Señora Acero,2018,5 Seasons,Crime TV Shows,"When her drug-trafficking husband dies, an unassuming woman stakes her own claim in the business in order to care for her gravely ill son."
TV Show,Chambers,2019,1 Season,TV Horror,"Haunted by eerie visions and sinister impulses after a heart transplant, a teenager tries to unmask the truth behind her donor's mysterious death."
TV Show,Imposters,2017,2 Seasons,Crime TV Shows,"Supported by a team of fellow thieves, a con artist lures her targets into matrimony and then absconds with their fortunes in this darkly comic series."
TV Show,Quicksand,2019,1 Season,Crime TV Shows,"After a tragedy at a school sends shock waves through a wealthy Stockholm suburb, a seemingly well-adjusted teen finds herself on trial for murder."
TV Show,Tijuana,2019,1 Season,Crime TV Shows,"When a prominent politician is murdered, the intrepid journalists of Frente Tijuana risk their lives to uncover the truth."
TV Show,Possessed,2019,1 Season,Crime TV Shows,A reluctant clairvoyant joins forces with a brusque police detective hiding a soft heart to help him solve criminal cases using her psychic abilities.
TV Show,The Eagle of El-Se'eed,2018,1 Season,Crime TV Shows,"A police officer and a drug lord become embroiled in a cycle of revenge, each man bent on taking the other down."
