type,title,release_year,duration,listed_in,description
TV Show,Crime Diaries: The Candidate,2019,1 Season,Crime TV Shows,"In 1994, Mexican presidential candidate Luis Donaldo Colosio's assassination sends his dying widow racing to uncover who did it. Based on true events."
TV Show,Delhi Crime,2019,1 Season,Crime TV Shows,"As Delhi reels in the aftermath of a gang rape, DCP Vartika Chaturvedi leads a painstaking search for the culprits. Based on the 2012 Nirbhaya case."
TV Show,The Disappearance of Madeleine McCann,2019,1 Season,Crime TV Shows,"The documentary takes a detailed look at the disappearance of 3-year-old Madeleine McCann, who vanished while on holiday with her family."
TV Show,American Crime Story: The People v. O.J. Simpson,2016,1 Season,Crime TV Shows,"This anthology series dramatizes historic criminal cases in the U.S., including the O.J. Simpson trial and Andrew Cunanan's 1997 murder spree."
TV Show,Unsolved,2018,1 Season,Crime TV Shows,Ride along for a dramatized version of the real-life investigations into the murders of rap icons Tupac Shakur and Biggie Smalls.
TV Show,The 43,2019,1 Season,Crime TV Shows,This docuseries disputes the Mexican government's account of how and why 43 students from Ayotzinapa Rural Teachers' College vanished in Iguala in 2014.
TV Show,The Kirlian Frequency,2017,1 Season,TV Horror,"In the midnight hour, a lone DJ broadcasts the strangest – and scariest – tales from the outer edges of Kirlian, a lost city somewhere in Argentina."
TV Show,The Break,2018,2 Seasons,Crime TV Shows,"A police detective mourning a painful loss moves back to his peaceful hometown, only to be drawn into a murder case that dredges up dark secrets."
TV Show,Hidden Worlds,2018,1 Season,Crime TV Shows,"While investigating an actress’s supposed suicide and her connection to the mafia, a veteran journalist discovers that corruption runs deep."
TV Show,Live,2018,1 Season,Crime TV Shows,The police officers at South Korea's busiest patrol division toil day and night as keepers of law and peace – but the reality is far from orderly.
TV Show,Safe,2018,1 Season,Crime TV Shows,"After his teenage daughter goes missing, a widowed surgeon in an affluent neighborhood begins unearthing dark secrets about the people closest to him."
TV Show,Sparta,2018,1 Season,Crime TV Shows,"While investigating the mysterious death of a teacher, a grizzled detective gets caught up in the world of a high-stakes virtual reality game."
TV Show,Examination of Conscience,2019,1 Season,Crime TV Shows,"Allegations of child sexual abuse in Spain's Catholic institutions are examined in interviews with survivors, clergy, journalists and other experts."
TV Show,Conversations with a Killer: The Ted Bundy Tapes,2019,1 Season,Crime TV Shows,"Present-day interviews, archival footage and audio recordings made on death row form a searing portrait of notorious serial killer Ted Bundy."
TV Show,Innocent,2017,1 Season,Crime TV Shows,"In a peaceful, rustic town, a retired officer and his family are mired in a murder mystery riddled with shocking, buried secrets."
TV Show,Marvel's The Punisher,2019,2 Seasons,Crime TV Shows,A former Marine out to punish the criminals responsible for his family's murder finds himself ensnared in a military conspiracy.
TV Show,In Family We Trust,2018,1 Season,Crime TV Shows,"When the head of the lucrative family business passes away, his will leaves the clan at extreme odds."
TV Show,Hashoter Hatov,2015,1 Season,Crime TV Shows,An honest – though overzealous – police officer strives to do good work while dealing with his bickering parents and incompetent coworkers.
TV Show,Murder Mountain,2018,1 Season,Crime TV Shows,"In Humboldt County, California, the big business of legal marijuana brings in visitors from around the world. Some are never seen again."
TV Show,Demon's Path,2018,1 Season,Crime TV Shows,"To catch three criminal masterminds, a group of cops teams up with a forensic pathologist who can see a murder victim's final moments before death."
TV Show,Perfume,2018,1 Season,Crime TV Shows,"When a singer is found murdered, with her scent glands excised from her body, detectives probe a group of friends who attended boarding school with her."
TV Show,Inside the Real Narcos,2018,1 Season,Crime TV Shows,"Exposing a rarely seen perspective on the drug wars, ex-Special Forces commando Jason Fox interviews dangerous traffickers and cartel members."
TV Show,The Innocent Man,2018,1 Season,Crime TV Shows,"This documentary adaptation of John Grisham's only nonfiction book raises troubling questions about two murder cases in Ada, Oklahoma, in the 1980s."
TV Show,Tidelands,2018,1 Season,Crime TV Shows,"Ex-con Cal McTeer's return to her hometown of Orphelin Bay blows the lid off a generations-long conspiracy of silence around murder, drugs and Sirens."
TV Show,Travelers,2018,3 Seasons,Crime TV Shows,"A federal agent tracks four people who suddenly seem to possess entirely new personalities, leading to a startling discovery about humanity's future."
TV Show,Dogs of Berlin,2018,1 Season,Crime TV Shows,"Two cops investigate the murder of a famous Turkish-German soccer player, but one of them has underworld connections that mire the case in controversy."
TV Show,Memories of the Alhambra,2018,1 Season,Crime TV Shows,"While looking for the cryptic creator of an innovative augmented-reality game, an investment firm executive meets a woman who runs a hostel in Spain."
TV Show,1983,2018,1 Season,Crime TV Shows,"In this dark alt-history thriller, a naïve law student and a world-weary detective uncover a conspiracy that has tyrannized Poland for decades."
TV Show,Fugitiva,2018,1 Season,Crime TV Shows,A domestic abuse survivor orchestrates an elaborate deception to protect her family from her powerfully wealthy husband and his vindictive enemies.
TV Show,Warrior,2018,1 Season,Crime TV Shows,A war veteran plagued by guilt over his final mission teams up with his best friend's widow to infiltrate a dangerous Copenhagen biker gang.
TV Show,The Queen of Flow,2018,1 Season,Crime TV Shows,"Seventeen years after being wrongly imprisoned, a talented songwriter seeks justice against the men who caused her downfall and killed her family."
TV Show,Transfers,2017,1 Season,Crime TV Shows,"After a boating accident, woodworker and family man Florian wakes up in the body of an officer who leads a task force against illegal body transfers."
TV Show,Damnation,2017,1 Season,Crime TV Shows,"During the Great Depression, a stranger with a violent past poses as a preacher and rallies farmers to mount a strike in a rural Iowa community."
TV Show,Terrorism Close Calls,2018,1 Season,Crime TV Shows,Law enforcement officials look back on attempted terrorist attacks that were thwarted in the nick of time.
TV Show,Making a Murderer,2018,2 Seasons,Crime TV Shows,"Filmed over 10 years, this real-life thriller follows a DNA exoneree who, while exposing police corruption, becomes a suspect in a grisly new crime."
TV Show,Marvel's Daredevil,2018,3 Seasons,Crime TV Shows,"Blinded as a young boy, Matt Murdock fights injustice by day as a lawyer and by night as the Super Hero Daredevil in Hell's Kitchen, New York City."
TV Show,Rake,2018,5 Seasons,Crime TV Shows,"While Cleaver Greene is a brilliant and driven attorney, he's also an ex-druggie, a current gambling addict and loathed by many of his colleagues."
TV Show,Edgar Rice Burroughs' Tarzan and Jane,2018,2 Seasons,Crime TV Shows,"Saved from a plane crash and given supernatural powers, teen Tarzan joins forces with brave city girl Jane to protect his jungle home from threats."
TV Show,Ordinary Heroes,2018,1 Season,Crime TV Shows,"Get an intimate look at four engaged citizens whose courage, sense of civic duty and ultimate sacrifice helped to transform Italian society."
TV Show,Blood Pact,2018,1 Season,Crime TV Shows,"An ambitious TV reporter uses risky and ethically questionable methods to report on gang wars and police corruption in the Amazon port of Belém, Brazil."
TV Show,The Good Cop,2018,1 Season,Crime TV Shows,"When he's not solving murders, a pathologically honest detective tries to keep an eye on his crooked but kindhearted dad."
TV Show,Al Hayba,2017,1 Season,Crime TV Shows,"In a village by the Lebanon-Syria border, the head of an arms-smuggling clan contends with family conflicts, power struggles and complicated love."
TV Show,American Vandal,2018,2 Seasons,Crime TV Shows,"A high school is rocked by an act of vandalism, but the top suspect pleads innocence and finds an ally in a filmmaker. A satirical true crime mystery."
TV Show,Ingobernable,2018,2 Seasons,Crime TV Shows,"The first lady of Mexico is a woman of conviction and ideals. But when she loses faith in her husband, she'll need all her strength to uncover the truth."
TV Show,Marvel's Iron Fist,2018,2 Seasons,Crime TV Shows,"Danny Rand resurfaces 15 years after being presumed dead. Now, with the power of the Iron Fist, he seeks to reclaim his past and fulfill his destiny."
TV Show,Monkey Twins,2018,1 Season,Crime TV Shows,"Inspired by Khon dance drama and Thai martial arts, a fighter scarred by the past joins forces with a determined cop to battle an organized crime ring."
TV Show,Quantico,2018,3 Seasons,Crime TV Shows,"When evidence in a deadly terrorist attack implicates FBI trainee Alex Parrish, she must discover which one of her classmates framed her."
TV Show,Age of Rebellion,2018,1 Season,Crime TV Shows,"At their high school, a group of unruly teens wreak havoc, face bullies and navigate turbulent lives beyond school grounds."
TV Show,Inside the Criminal Mind,2018,1 Season,Crime TV Shows,Explore the psychological machinations and immoral behavior that define the most nefarious types of criminals.
TV Show,Undercover Law,2017,1 Season,Crime TV Shows,Female intelligence agents infiltrate the disparate aspects of a Colombian cartel in an attempt to take down the drug lords and their associates.
TV Show,Cocaine Coast,2018,1 Season,Crime TV Shows,"In 1980s Galicia, Spain, a young fisherman becomes a prosperous cocaine smuggler by providing Latin American suppliers with a European entry point."
TV Show,El Chapo,2018,3 Seasons,Crime TV Shows,"This drama series chronicles the true story of the rise, capture and escape of notorious Mexican drug lord Joaquín ""El Chapo"" Guzmán."
TV Show,Smoking,2018,1 Season,Crime TV Shows,"Seeking a greater justice, a band of homeless assassins flays their human targets and delivers the tattooed skins as proof of a contract fulfilled."
TV Show,Drug Lords,2018,2 Seasons,Crime TV Shows,"Witness the stories of history's most notorious kingpins, their terrifying enforcers, and the men and women who've sworn to bring them down."
TV Show,NCIS,2017,15 Seasons,Crime TV Shows,Follow the quirky agents of the NCIS – the Naval Criminal Investigative Service – as they track down terrorists and other high-profile criminals.
TV Show,Somewhere Between,2017,1 Season,Crime TV Shows,"A local news producer is given one chance to relive a deadly week and stop a serial killer. If she fails, she'll lose her daughter forever."
TV Show,Kiss Me First,2018,1 Season,Crime TV Shows,A lonely young woman hooked on a virtual reality game befriends a party girl who leads her into a world of new thrills and dark secrets.
TV Show,Marvel's Luke Cage,2018,2 Seasons,Crime TV Shows,"A hoodie-wearing, unbreakable ex-con fights to clear his name and save his neighborhood. He wasn't looking for a fight, but the people need a hero."
TV Show,The Staircase,2018,1 Season,Crime TV Shows,"Accident or murder? After the mysterious death of his wife, author Michael Peterson watches his life go under the microscope."
TV Show,November 13: Attack on Paris,2018,1 Season,Crime TV Shows,"Survivors and first responders share personal stories of anguish, kindness and bravery that unfolded amid the Paris terror attacks of Nov. 13, 2015."
TV Show,Inspector Gadget,2017,4 Seasons,Crime TV Shows,"Inspector Gadget is back and must face his old enemy, the evil Dr. Claw, who has reactivated MAD, his global crime syndicate."
TV Show,Evil Genius,2018,1 Season,Crime TV Shows,This baffling true crime story starts with the grisly death of a pizza man who robs a bank with a bomb around his neck – and gets weirder from there.
TV Show,The Chalet,2018,1 Season,Crime TV Shows,Friends gathered at a remote chalet in the French Alps for a summer getaway are caught in a deadly trap as a dark secret from the past comes to light.
TV Show,Fallet,2017,1 Season,Crime TV Shows,A Swedish detective and her timid British colleague's attempt to solve a gruesome murder case nets mixed results and miscommunication.
TV Show,Trailer Park Boys,2018,12 Seasons,Crime TV Shows,Follow the booze-fueled misadventures of three longtime pals and petty serial criminals who run scams from their Nova Scotia trailer park.
TV Show,Wild Wild Country,2018,1 Season,Crime TV Shows,"When a controversial cult leader builds a utopian city in the Oregon desert, conflict with the locals escalates into a national scandal."
TV Show,Collateral,2018,1 Season,Crime TV Shows,"Investigating the murder of a pizza delivery man, a London detective uncovers a tangled conspiracy involving drug dealers, smugglers and spies."
TV Show,Bad Guys: Vile City,2018,1 Season,Crime TV Shows,"Ordered to take down a villainous business leader who controls the city, a prosecutor gathers a team of men who may not be so clean themselves."
TV Show,Borderliner,2017,1 Season,Crime TV Shows,"To protect his family, a police detective covers up a murder case. But when his partner suspects foul play, he is trapped in a dangerous game on duty."
TV Show,21 Thunder,2017,1 Season,Crime TV Shows,"Players and coaches for a Montreal soccer team chase dreams of stardom while their personal lives erupt with love, fear, passion and violence."
TV Show,Seven Seconds,2018,1 Season,Crime TV Shows,The death of a 15-year-old African American boy in Jersey City sets off a police cover-up and a search for the truth.
TV Show,The Frankenstein Chronicles,2017,2 Seasons,Crime TV Shows,"A detective tracks what seems to be a killer with a taste for dismemberment in 1827 London, but the case leads in a far more terrifying direction."
TV Show,Under Arrest,2016,8 Seasons,Crime TV Shows,"Cameras follow police officers as they solve crimes, assist the public and arrest lawbreakers in this reality series."
TV Show,Retribution,2016,1 Season,Crime TV Shows,A dark web of secrets and lies emerges when a newlywed couple is killed and detectives question their feuding families.
TV Show,The Frozen Dead,2017,1 Season,Crime TV Shows,A grisly find atop a mountain in the French Pyrenees leads investigator Martin Servaz into a twisted dance with a serial killer in this icy thriller.
TV Show,La Mante,2017,1 Season,Crime TV Shows,"Decades after her capture, a serial killer offers to help solve a string of copycat murders – but only if her son, now a cop, will work by her side."
TV Show,The Indian Detective,2017,1 Season,Crime TV Shows,"In this crime dramedy, a suspended Canadian cop visits his father in Mumbai and assists in investigating a huge criminal operation with links to home."
TV Show,Wormwood,2017,1 Season,Crime TV Shows,"In this genre-bending tale, Errol Morris explores the mysterious death of a U.S. scientist entangled in a secret Cold War program known as MK-Ultra."
TV Show,Broadchurch,2017,3 Seasons,Crime TV Shows,"After a young boy is murdered in the small seaside town of Broadchurch, local detectives Ellie Miller and Alec Hardy are assigned the mysterious case."
TV Show,Longmire,2017,6 Seasons,Crime TV Shows,This contemporary crime thriller focuses on a Wyoming sheriff who's rebuilding his life and career following the death of his wife.
TV Show,The Method,2015,1 Season,Crime TV Shows,An ambitious young law enforcement graduate is thrilled when her idol takes her on as a trainee. But his methods aren't anything like she imagined.
TV Show,Alias Grace,2017,1 Season,Crime TV Shows,"In 19th-century Canada, a psychiatrist weighs whether a murderess should be pardoned due to insanity. Based on Margaret Atwood's award-winning novel."
TV Show,The Truth,2008,1 Season,Crime TV Shows,"A devious businessman covets his partner's priceless treasure map, while a related murder case calls into question some biological family ties."
TV Show,The Day I Met El Chapo,2017,1 Season,Crime TV Shows,"Mexican superstar actress Kate del Castillo reveals the untold story of her encounter with El Chapo Guzmán, the world’s most-wanted drug lord."
TV Show,Dark Matter,2017,3 Seasons,TV Sci-Fi & Fantasy,"After waking up aboard a derelict spaceship with no memories, the crew of the Raza investigates the mystery of their identities and destination."
TV Show,Apaches,2016,1 Season,Crime TV Shows,A young journalist is forced into a life of crime to save his father and family in this series based on the novel by Miguel Sáez Carral.
TV Show,Frequency,2016,1 Season,Crime TV Shows,"A detective seizes a precious opportunity to change the past when she finds she can communicate with her deceased, estranged father via a time warp."
TV Show,Narcos,2017,3 Seasons,Crime TV Shows,The true story of Colombia's infamously violent and powerful drug cartels fuels this gritty gangster drama series.
TV Show,Marvel's The Defenders,2017,1 Season,Crime TV Shows,"Daredevil, Jessica Jones, Luke Cage and Iron Fist join forces to take on common enemies as a sinister conspiracy threatens New York City."
TV Show,20 Minutes,2013,1 Season,Crime TV Shows,"When his wife is convicted of murder, a horrified family man races to prove her innocence while a dogged investigator sets out to uncover the truth."
TV Show,Million Yen Women,2017,1 Season,Crime TV Shows,"Five beautiful but mysterious women move in with unsuccessful novelist Shin, who manages their odd household in exchange for a tidy monthly sum."
TV Show,Close Your Eyes Before It’s Dark,2016,1 Season,Crime TV Shows,"While vacationing at a mountain cabin, a group of longtime friends uncovers an old scandal that could have deadly consequences."
TV Show,Fartsa,2015,1 Season,Crime TV Shows,"As four Russian friends grow up in the early '60s, life, love and the curse of success threaten to derail their dreams."
TV Show,"Have You Ever Fallen in Love, Miss Jiang?",2016,1 Season,Crime TV Shows,A new teacher finds herself in an unenviable situation after witnessing a troubling interaction between an administrator and a student.
TV Show,Locust,2014,1 Season,Crime TV Shows,"A torrid affair between a passionate lowborn poet and a wealthy Moscow heiress is engulfed by class difference, criminality and, eventually, murder."
TV Show,Surviving Escobar - Alias JJ,2017,1 Season,Crime TV Shows,"As the Medellín Cartel crumbles, Pablo Escobar's No. 1 hit man struggles to stay alive and gain respect in the prison hierarchy."
TV Show,Vexed,2012,2 Seasons,Crime TV Shows,Charming slacker DI Jack Armstrong and driven professional DI Kate Bishop try to solve crimes together without driving each other crazy.
TV Show,Against the Tide,2014,1 Season,Crime TV Shows,A detective and a psychologist investigating a string of murders form a crime-solving team with the novelist whose work inspired the killings.
TV Show,The Truth Seekers,2016,1 Season,Crime TV Shows,"A veteran cop forms an agency dedicated to solving cold cases, including those related to the team members' own painful and mysterious pasts."
TV Show,Unriddle,2012,2 Seasons,Crime TV Shows,"When a hard-nosed detective reluctantly partners with an informant to solve complex cases, she uncovers links to a particularly puzzling cold case."
TV Show,Criminal Minds,2017,12 Seasons,Crime TV Shows,This intense police procedural follows a group of extraordinary FBI profilers who spend their days getting into the minds of psychopathic criminals.
TV Show,Aquarius,2016,2 Seasons,Crime TV Shows,"Amid the turmoil of 1960s LA, two cops and a prominent political family are drawn into the sex- and drug-fueled web of a young Charles Manson."
TV Show,Man to Man,2017,1 Season,Crime TV Shows,"Disguised as a bodyguard, a special agent must complete his national secret tasks while pandering to the whims of his ill-tempered world star."
TV Show,My Little Baby,2016,1 Season,Crime TV Shows,A top detective in the violent crimes unit becomes the sole guardian of his 6-month-old niece when his sister and her husband pass away unexpectedly.
TV Show,Mind Game,2015,1 Season,Crime TV Shows,"With the help of a cop, a psychologist and a woman who can foretell the future, a brilliant paralegal works to solve an array of perplexing mysteries."
TV Show,The Keepers,2017,1 Season,Crime TV Shows,This docuseries examines the decades-old murder of Sister Catherine Cesnik and its suspected link to a priest accused of abuse.
TV Show,Mar de Plástico,2017,2 Seasons,Crime TV Shows,"In a town in southern Spain where racial tensions run high among the workers in its many greenhouses, a cop investigates the murder of a young woman."
TV Show,Sense8,2018,2 Seasons,Crime TV Shows,"From the creators of ""The Matrix"" and ""Babylon 5"" comes this tense series in which eight people can telepathically experience each other's lives."
TV Show,Captive,2016,1 Season,Crime TV Shows,"This documentary series reconstructs history's most complex, high-stakes hostage negotiations as kidnapping victims recount their terrifying ordeals."
TV Show,La Niña,2016,1 Season,Crime TV Shows,A former Colombian guerrilla fighter faces challenges as she reintegrates into society and tries to overcome her traumatic memories.
TV Show,Paranoid,2016,1 Season,Crime TV Shows,"When a woman is brutally murdered on a playground, a group of detectives find themselves drawn into a dark conspiracy as they search for the killer."
TV Show,Case,2015,1 Season,Crime TV Shows,A smart lawyer whose drinking and recklessness send him on a path of self-destruction finds new purpose investigating a teenager's apparent suicide.
TV Show,Spotless,2015,1 Season,Crime TV Shows,The law-abiding owner of a crime scene cleaning service is forced into business with a powerful mob boss thanks to his irresponsible older brother.
TV Show,Forensic Files,2011,9 Seasons,Crime TV Shows,Detectives and crime lab technicians use the latest and most fascinating procedures to solve crimes in this documentary-style show.
TV Show,Witches: A Century of Murder,2015,1 Season,Crime TV Shows,"Historian Suzannah Lipscomb investigates the witch hunts that plagued Britain in the 17th century, examining common myths about their origin."
TV Show,Caught on Camera,2015,3 Seasons,Crime TV Shows,"Nick Wallis presents crimes caught on CCTV, cell phones and other devices and reveals how investigators use the recordings to solve tough cases."
TV Show,Cocaine,2005,1 Season,Crime TV Shows,"Three films chronicle the cocaine trade's sweeping impact on the citizens of Peru, Brazil and Colombia, from poor farmers to powerful drug lords."
TV Show,Hemlock Grove,2015,3 Seasons,TV Horror,"Secrets are just a part of daily life in the small Pennsylvania town of Hemlock Grove, where the darkest evils hide in plain sight."
TV Show,Lilyhammer,2014,3 Seasons,Crime TV Shows,"After testifying against the Mafia, ex-gangster Frank Tagliano enters witness protection and asks to be sent to Norway."
TV Show,Breaking Bad,2013,5 Seasons,Crime TV Shows,A high school chemistry teacher dying of cancer teams with a former student to secure his family's future by manufacturing and selling crystal meth.
TV Show,Şubat,2013,1 Season,Crime TV Shows,"An orphan subjected to tests that gave him superpowers is rescued and raised on Istanbul's streets, where he falls for a reporter linked to his past."
TV Show,A Man Called God,2010,1 Season,Crime TV Shows,"Raised in America, government agent Choi Kang-Ta returns to Korea with the skills of an assassin and a thirst for revenge on his father’s killers."
TV Show,Agent Raghav,2015,1 Season,Crime TV Shows,"A mix of brilliance, erudition and skill enables a modern Sherlock Holmes to solve impossible cases, all while he tries to heal personal wounds."
TV Show,American Crime,2017,3 Seasons,Crime TV Shows,"This anthology series unfolds a different story arc for each season, with dramas focusing on aspects of American life and the criminal justice system."
TV Show,Anjaan: Rural Myths,2018,1 Season,TV Horror,"Spine-chilling stories of malevolent spirits unfold in villages, jungles and haunted buildings across India."
TV Show,Anjaan: Special Crimes Unit,2018,1 Season,TV Horror,"The cases are supernatural; the police officers human. Together, cops Aditi and Vikrant must solve mysteries from the realm of the paranormal."
TV Show,Atomic Puppet,2016,1 Season,Crime TV Shows,"Captain Atomic – once a superhero, now a sock puppet – can only activate his powers with the help of Joey, his new partner and biggest fan."
TV Show,Bates Motel,2017,5 Seasons,Crime TV Shows,"When his father dies, Norman Bates and his mother open a hotel. But Norman's precarious mental state drives them down a dark and violent path."
TV Show,Battle Creek,2015,1 Season,Crime TV Shows,"A polished FBI agent must team up with a cynical cop when he's dispatched to Battle Creek, Michigan, to set up an office at the local precinct."
TV Show,Beauty & the Beast,2016,4 Seasons,Crime TV Shows,A homicide detective and a veteran who has been turned into a beast by a military experiment gone awry become allies after they meet by chance.
TV Show,Behzat Ç.,2010,1 Season,Crime TV Shows,An Ankara homicide detective with a dark personal life and a disdain for rules and political correctness solves murders and fights police corruption.
TV Show,Bitter Daisies,2018,1 Season,Crime TV Shows,"While investigating the disappearance of a teen girl in a tight-knit Galician town, a Civil Guard officer uncovers secrets linked to a loss of her own."
