type,title,release_year,duration,listed_in,description
TV Show,Jailbirds New Orleans,2021,1 Season,Reality TV,"Feuds, flirtations and toilet talk go down among the incarcerated women at the Orleans Justice Center in New Orleans on this gritty reality series."
TV Show,The Great British Baking Show,2021,9 Seasons,Reality TV,"A talented batch of amateur bakers face off in a 10-week competition, whipping up their best dishes in the hopes of being named the U.K.'s best."
TV Show,Love on the Spectrum,2021,2 Seasons,Reality TV,"Finding love can be hard for anyone. For young adults on the autism spectrum, exploring the unpredictable world of dating is even more complicated."
TV Show,Nailed It,2021,6 Seasons,Reality TV,"Home bakers with a terrible track record take a crack at re-creating edible masterpieces for a $10,000 prize. It's part reality contest, part hot mess."
TV Show,Too Hot To Handle: Latino,2021,1 Season,Reality TV,"On this reality show, singles from Latin America and Spain are challenged to give up sex. But here, abstinence comes with a silver lining: US$100,000."
TV Show,The World's Most Amazing Vacation Rentals,2021,2 Seasons,Reality TV,"With an eye for every budget, three travelers visit vacation rentals around the globe and share their expert tips and tricks in this reality series."
TV Show,Metal Shop Masters,2021,1 Season,Reality TV,"On this competition show, a group of metal artists torch, cut and weld epic, badass creations from hardened steel. Only one will win a $50,000 prize."
TV Show,The Circle,2021,3 Seasons,Reality TV,"Status and strategy collide in this social experiment and competition show where online players flirt, befriend and catfish their way toward $100,000."
TV Show,How to Be a Cowboy,2021,1 Season,Reality TV,"Dale Brisby uses social media savvy and rodeo skills to keep cowboy traditions alive — and now he's teaching the world how to cowboy right, ol' son."
TV Show,Sparking Joy,2021,1 Season,Reality TV,"In this reality series, Marie Kondo brings her joyful tidying tactics to people struggling to balance work and home life — and shares her own world."
TV Show,Titletown High,2021,1 Season,Reality TV,"In a Georgia town where football rules and winning is paramount, a high school team tackles romance, rivalries and real life while vying for a title."
TV Show,Motel Makeover,2021,1 Season,Reality TV,"Amid project pitfalls and a pandemic, besties-turned-business partners bring their design magic to a rundown motel and revamp it into a go-to getaway."
TV Show,Wheel of Fortune,2019,3 Seasons,Reality TV,"Pat Sajak and Vanna White host one of TV's most popular, long-running game shows, where players spin a wheel for prizes and solve mystery phrases."
TV Show,Bake Squad,2021,1 Season,Reality TV,Expert bakers elevate desserts with next-level ideas and epic execution. Now the battle is on to win over clients in need of very special sweets.
TV Show,Car Masters: Rust to Riches,2021,3 Seasons,Reality TV,"The colorful crew at Gotham Garage overhauls an eclectic collection of cars and trucks, trading up to a showstopper they can sell for big bucks."
TV Show,Cooking With Paris,2021,1 Season,Reality TV,"With an anyone-can-cook attitude, Paris Hilton adds her own flair to every dish. Fun is just one edible glitter bomb away on this unique cooking show."
TV Show,Glow Up,2021,3 Seasons,Reality TV,"In this competition show, aspiring makeup artists navigate colorful challenges to win a career-making opportunity in the beauty industry."
TV Show,Khawatir,2009,1 Season,Reality TV,Saudi media personality Ahmad Al Shugairi travels around the world on a quest for knowledge in various cities while offering his personal reflections.
TV Show,Tattoo Redo,2021,1 Season,Reality TV,"Bad tattoos walk in. Great tattoos walk out. Top artists transform tattoo disasters into stunning cover-ups, with designs chosen by clients' loved ones."
TV Show,Sexy Beasts,2021,1 Season,Reality TV,"Hoping to say goodbye to superficial dating, real-life singles sport elaborate makeup and prosthetics to put true blind-date chemistry to the test."
TV Show,Too Hot to Handle: Brazil,2021,1 Season,Reality TV,"Sizzling hot young Brazilians meet at a dreamy beach resort. But for a shot at R$500,000 in this fun reality show, they'll have to give up sex."
TV Show,My Unorthodox Life,2021,1 Season,Reality TV,"Follow Julia Haart, Elite World Group CEO and a former member of an ultra-Orthodox Jewish community, and her adult kids in this reality series."
TV Show,Terrace House: Opening New Doors,2018,6 Seasons,Reality TV,"A group of young people – including a chef, a snowboarder and an ice hockey player – gather in the Karuizawa woods while pursuing their dreams."
TV Show,Big Timber,2020,1 Season,Reality TV,A no-nonsense logger and his loyal crew battle brutal elements and finicky machines to chop and transport valuable lumber on Vancouver Island.
TV Show,Droppin' Cash: Los Angeles,2019,1 Season,Reality TV,This Complex series follows the paper trail of musicians and athletes in Los Angeles as they blow through stacks on the finer things in life.
TV Show,The Parisian Agency: Exclusive Properties,2021,1 Season,Reality TV,This reality series follows the Kretz family and their luxury property business as they help clients buy and sell fabulous homes in France and abroad.
TV Show,Too Hot to Handle,2021,2 Seasons,Reality TV,"On the shores of paradise, gorgeous singles meet and mingle. But there’s a twist. To win a $100,000 grand prize, they’ll have to give up sex."
TV Show,The Mole,2001,2 Seasons,Reality TV,"In this competition show, contestants try to earn $1 million for a pot that only one of them will win — while one player secretly sabotages them."
TV Show,No Time for Shame,2019,1 Season,Reality TV,"Follow Santiago Artemis, a Buenos Aires fashion dynamo, as he makes his dreams come true while grappling with his love life, therapist and clients."
TV Show,REA(L)OVE,2018,1 Season,Reality TV,"A group of men and women, each burdened with a dark secret, look for love in this dating show with a twist. Hosted by reformed playboy Atsushi Tamura."
TV Show,The American Bible Challenge,2014,1 Season,Reality TV,"Join host Jeff Foxworthy as contestants test their knowledge of all things biblical, competing to win money for the charities of their choice."
TV Show,"Fresh, Fried & Crispy",2021,1 Season,Reality TV,"Passionate about food and ready for fun, critic Daym Drops drops in on America's smokin' hot spots for the best, freshest takes on fried food."
TV Show,Haunted,2021,3 Seasons,Reality TV,"Real people sit down with friends and family to share terrifying true stories from their past, re-created through chilling re-enactments."
TV Show,The Mystic River,2020,1 Season,TV Horror,"As pregnant women vanish in a remote Nigerian village over decades, a doctor with child finds herself extremely close to uncovering dangerous secrets."
TV Show,Lava Ka Dhaava,2021,1 Season,Reality TV,Actor Jaaved Jaafferi brings his signature humor to this Hindi dubbing of the show where teams creatively navigate rooms flooded with make-believe lava.
TV Show,Pet Stars,2021,1 Season,Reality TV,Follow talent management company Pets on Q as they work with the biggest animal influencers on social media in this reality series.
TV Show,Next in Fashion,2020,1 Season,Reality TV,"Talented designers from around the world compete for $250,000 and the chance to become the next big thing in fashion."
TV Show,Indian Matchmaking,2020,1 Season,Reality TV,"Matchmaker Sima Taparia guides clients in the U.S. and India in the arranged marriage process, offering an inside look at the custom in a modern era."
TV Show,Slasher,2019,3 Seasons,TV Horror,Rampaging serial killers leave carnage in their wake as their next victims fight to stay alive in this horror anthology series.
TV Show,Don't be the First one,2021,1 Season,Reality TV,"Is marriage just better between funny people? Revealing their day-to-day lives, celebrity comedian couples explore the bonds that keep them together."
TV Show,The Big Day,2021,2 Seasons,Reality TV,"For six engaged couples, happily ever after begins on a spectacular note in this eye-popping look at India’s multibillion-dollar wedding industry."
TV Show,The Wedding Coach,2021,1 Season,Reality TV,Former bride and forever comedian Jamie Lee shares her irreverent yet practical tips and tricks for wedding planning with struggling lovebirds.
TV Show,Worn Stories,2021,1 Season,Reality TV,"In this funny, heartfelt and moving docuseries, real people unpack the fascinating and quirky stories around their most meaningful pieces of clothing."
TV Show,Haunted: Latin America,2021,1 Season,Reality TV,"Real people's terrifying tales of the chilling, unexplained and paranormal come to life with dramatic reenactments in this reality series."
TV Show,Magic for Humans Spain,2021,1 Season,Reality TV,"In this Spanish adaptation of ""Magic for Humans,"" folks of all ages on the streets of Barcelona are amazed by tricks that inspire delight and wonder."
TV Show,Marriage or Mortgage,2021,1 Season,Reality TV,A wedding planner and a real estate agent compete to win the hearts and budgets of spouses-to-be. Will they pick fairy-tale nuptials or a dream home?
TV Show,Canine Intervention,2021,1 Season,Reality TV,"No dog, no breed, no behavior is unfixable for Cali K9's Jas Leverette. Follow the Oakland dog trainer as he works with a range of canines and owners."
TV Show,Buried by the Bernards,2021,1 Season,Reality TV,"In this reality series, the bickering but big-hearted Bernards manage their budget-friendly funeral home while helping grieving families say farewell."
TV Show,Nadiya Bakes,2021,1 Season,Reality TV,"Delightful cakes and heavenly breads pop from the oven as Nadiya Hussain returns to baking, her happy place, and spotlights creative kindred spirits."
TV Show,Blown Away,2021,2 Seasons,Reality TV,"Ten master artists turn up the heat in glassblowing sculpture challenges for the chance to win $60,000 in prizes and the title of champion."
TV Show,Bling Empire,2021,1 Season,Reality TV,"Follow LA's wildly wealthy Asian and Asian American fun seekers as they go all out with fabulous parties, glamour and drama in this reality series."
TV Show,Surviving Death,2021,1 Season,Reality TV,"What happens after we die? This docuseries explores personal stories and research on near-death experiences, reincarnation and paranormal phenomena."
TV Show,Nailed It! Mexico,2021,3 Seasons,Reality TV,"The fun, fondant and hilarious cake fails head to Mexico, where very amateur bakers compete to re-create elaborate sweet treats for a cash prize."
TV Show,Dream Home Makeover,2021,2 Seasons,Reality TV,"Dreams come true for real families looking for the perfect home tailored to their own unique style, thanks to Shea and Syd McGee of Studio McGee."
TV Show,Chilling Adventures of Sabrina,2020,4 Seasons,TV Horror,"Magic and mischief collide as half-human, half-witch Sabrina navigates between two worlds: mortal teen life and her family's legacy, the Church of Night."
TV Show,Best Leftovers Ever!,2020,1 Season,Reality TV,Decadent pasta from day-old fries? Skillful cooks transform tired leftovers into tantalizing new dishes in this wildly creative culinary competition.
TV Show,Black Ink Crew New York,2014,2 Seasons,Reality TV,"At a Black-owned-and-operated hotspot for ink in Harlem, tattoo king Ceaser looks to expand his empire while working with a rambunctious crew."
TV Show,Teen Mom 2,2011,2 Seasons,Reality TV,"The highs and lows of new parenting and adulting create drama and heartbreak as life moves on for the cast of ""16 and Pregnant"" Season 2."
TV Show,The Challenge,2006,2 Seasons,Reality TV,Reality show alumni must compete in grueling physical contests and survive eliminations amid cutthroat alliances and steamy hookups to win big money.
TV Show,The Great British Baking Show: Holidays,2020,3 Seasons,Reality TV,"Deck the halls with sugar, butter and chocolate as competitors from past seasons bake sweet Yuletide treats for judges Paul Hollywood and Prue Leith."
TV Show,Are You The One,2014,2 Seasons,Reality TV,"Determined by a dating algorithm, a group of single contestants must identify their perfect matches for a shot at love and a cash prize."
TV Show,Ink Master,2012,2 Seasons,Reality TV,"Ten of the country's most skilled tattoo artists compete for $100,000 and the title of Ink Master in this high-stakes elimination competition."
TV Show,The Bachelorette,2010,1 Season,Reality TV,Beloved “Bachelor” contestant Ali Fedotowsky embarks on her own search for happily ever after and navigates the thrills and spills of reality TV romance.
TV Show,The Guest,2018,1 Season,TV Horror,"Bound together by a tragic past, a psychic, a priest and a detective join forces to take down a powerful spirit that's driven by bloodthirst."
TV Show,The Repair Shop,2018,1 Season,Reality TV,Expert artisans restore timeworn family heirlooms with touching sentimental value while also uncovering their uniquely rich histories.
TV Show,Fabulous Lives of Bollywood Wives,2020,1 Season,Reality TV,"Cameras follow the banter and bonding between four fun-loving women from Bollywood’s inner circle as they juggle professions, family and friendship."
TV Show,Sugar Rush Christmas,2020,2 Seasons,Reality TV,"It's everything you love about ""Sugar Rush"" – with a holly jolly holiday twist – in this Christmas-themed spin on competitive baking."
TV Show,Voices of Fire,2020,1 Season,Reality TV,"In this faith-based docuseries, Bishop Ezekiel Williams builds an inspiring, nontraditional gospel choir with the help of superstar nephew Pharrell."
TV Show,Holiday Home Makeover with Mr. Christmas,2020,1 Season,Reality TV,"Interior designer Benjamin “Mr. Christmas” Bradley works with a trusty team of ""elves” to help families transform their homes for the holidays."
TV Show,We Are the Champions,2020,1 Season,Reality TV,"Explore an array of unique competitions, from the quirky to the bizarre, and meet their passionate communities in this docuseries."
TV Show,America's Next Top Model,2013,2 Seasons,Reality TV,Supermodel Tyra Banks created and executive-produced this reality series that chronicles the transformation of young women into potential supermodels.
TV Show,Survivor,2014,2 Seasons,Reality TV,"In this long-running reality competition series, players battle the elements and each other as they vie for $1 million and the title of Sole Survivor."
TV Show,American Horror Story,2019,9 Seasons,TV Horror,"This twisted Emmy-winning drama plays upon the power of supernatural fears and everyday horrors, exploring humankind's unsettling capacity for evil."
TV Show,A Queen Is Born,2020,1 Season,Reality TV,Gloria Groove and Alexia Twister make drag dreams come true as they help six artists find the confidence to own the stage in this makeover show.
TV Show,Country Ever After,2020,1 Season,Reality TV,"Country artist Coffey Anderson and his wife, hip-hop dancer Criscilla, juggle family life, career goals and tests of faith in this reality series."
TV Show,60 Days In,2019,1 Season,Reality TV,"Recruited by a sheriff, volunteers infiltrate county prisons to expose corruption and crime from within the system in this docuseries."
TV Show,Forged in Fire,2019,1 Season,Reality TV,Bladesmiths vie for a cash prize by forging the best metal weapons from the pages of history in this competition series featuring expert judges.
TV Show,Zumbo's Just Desserts,2019,1 Season,Reality TV,"Dessert wizard Adriano Zumbo looks for the next “Willy Wonka” in this tense competition that finds skilled amateurs competing for a $100,000 prize."
TV Show,Somebody Feed Phil,2020,4 Seasons,Reality TV,"""Everybody Loves Raymond"" creator Phil Rosenthal travels the globe to take in the local cuisine and culture of Bangkok, Lisbon, Mexico City and more."
TV Show,The Cabin with Bert Kreischer,2020,1 Season,Reality TV,"Fast-living comic Bert Kreischer heads to a cabin for some self-care and invites his funny friends to join his quest to cleanse his mind, body and soul."
TV Show,The American Barbecue Showdown,2020,1 Season,Reality TV,Eight of the country's best backyard smokers and pitmasters vie for the title of American Barbecue Champion in a fierce but friendly faceoff.
TV Show,Sing On!,2020,1 Season,Reality TV,"In this fun, fast-paced music contest hosted by Tituss Burgess, players sing their hearts out and try to hit the right notes to win up to $60,000."
TV Show,Taco Chronicles,2020,2 Seasons,Reality TV,"Many of the most popular taco styles have long, rich, little-known histories. Explore some of them in this eye-opening, mouth-watering food adventure."
TV Show,Get Organized with The Home Edit,2020,1 Season,Reality TV,"Expert home organizers Clea and Joanna help celebrities and everyday clients edit, categorize and contain their clutter to create stunning spaces."
TV Show,Chef's Table: BBQ,2020,1 Season,Reality TV,"The Emmy-nominated series delves into the juicy, smoky world of barbecue, visiting acclaimed chefs and pitmasters in the US, Australia and Mexico."
TV Show,Million Dollar Beach House,2020,1 Season,Reality TV,The competition is fierce — and the drama undeniable — as a group of young and hungry agents try to seal the deal on luxury listings in the Hamptons.
TV Show,Baewatch: Parental Guidance,2019,1 Season,Reality TV,"Couples go on a romantic getaway to test their relationships, not knowing their families are calling the shots and cringing over their every move."
TV Show,Rust Valley Restorers,2020,3 Seasons,Reality TV,"Old-school auto collector Mike Hall, his pal Avery Shoaf and son Connor Hall go the extra mile to restore retro cars – and hopefully turn a profit."
TV Show,Goedam,2020,1 Season,TV Horror,"When night falls on the city, shadows and spirits come alive in this horror anthology series centered on urban legends."
TV Show,DeMarcus Family Rules,2020,1 Season,Reality TV,Rascal Flatts bassist Jay DeMarcus and ex-beauty queen Allison DeMarcus write their own rules for juggling family and fun in this reality show.
TV Show,(Un)Well,2020,1 Season,Reality TV,"This docuseries takes a deep dive into the lucrative wellness industry, which touts health and healing. But do the products live up to the promises?"
TV Show,Terrace House: Tokyo 2019-2020,2019,2 Seasons,Reality TV,"Six strangers share a fabulous house in Tokyo, looking for love while living under the same roof. With no script, what happens next is all up to them."
TV Show,Selling Sunset,2020,3 Seasons,Reality TV,The elite real estate brokers at The Oppenheim Group sell the luxe life to affluent buyers in LA. The drama ramps up when a new agent joins the team.
TV Show,Sing On! Germany,2020,1 Season,Reality TV,"In this karaoke competition hosted by Palina Rojinski, contestants must hit the right note for a chance to win up to 30,000 euros."
TV Show,Sugar Rush,2020,3 Seasons,Reality TV,Time's the most important ingredient as teams race against the clock – and each other – to bake up the best-tasting sweets.
TV Show,Sing On! Spain,2020,1 Season,Reality TV,"In this fast-paced, high-energy karaoke competition, singers from all walks of life battle it out for up to 30,000 euros!"
TV Show,Single Wives,2018,1 Season,Reality TV,"Looking for a second chance at love, four formerly married women are put in various romantic situations then receive feedback from a dating coach."
TV Show,Skin Decision: Before and After,2020,1 Season,Reality TV,Skin and beauty expert Nurse Jamie and plastic surgeon Dr. Sheila Nazarian use the latest procedures to bring out their clients' best selves.
TV Show,Dating Around: Brazil,2020,1 Season,Reality TV,"In this reality show, six singles meet five different blind dates at trendy urban hot spots in Brazil. Who will they choose for a second outing?"
TV Show,JU-ON: Origins,2020,1 Season,TV Horror,A paranormal researcher searches obsessively for a cursed home where something terrible happened to a mother and her child long ago.
TV Show,Southern Survival,2020,1 Season,Reality TV,"The BattlBox crew tests out products designed to help people survive dangerous situations, including explosions, natural disasters and intruders."
TV Show,Supermarket Sweep,1993,1 Season,Reality TV,"In this iconic game show, contestants answer food trivia questions then race against the clock while stuffing their carts for massive grocery gains."
TV Show,21 Again,2019,1 Season,Reality TV,"In a social experiment, a group of daughters sends their mothers, disguised as 21-year-olds, into the world to experience life as a member of Gen Z."
TV Show,Say I Do,2020,1 Season,Reality TV,"In this reality show, couples overcome obstacles to celebrate their love in surprise dream weddings designed by three experts in less than a week."
TV Show,Twogether,2020,1 Season,Reality TV,"Paired together for an unforgettable trip across Asia, stars Lee Seung-gi and Jasper Liu become buddies as they connect with fans and local cultures."
TV Show,Crazy Delicious,2020,1 Season,Reality TV,"In this competition show, daring home chefs tempt the food gods with reinvented classics and fanciful feasts in their quest to win a golden apple."
TV Show,Floor Is Lava,2020,1 Season,Reality TV,"Teams compete to navigate rooms flooded with lava by leaping from chairs, hanging from curtains and swinging from chandeliers. Yes, really."
TV Show,The Chase,2015,2 Seasons,Reality TV,"Brooke Burns hosts this game show in which three contestants square off to answer fast-paced questions against ""the Beast,"" a trivia know-it-all."
TV Show,Dating Around,2020,2 Seasons,Reality TV,"In each episode of flirtations and fails, one real-life single navigates five blind dates. The mission: Find one match worthy of a second date."
TV Show,Reality Z,2020,1 Season,TV Horror,"With Rio de Janeiro under a zombie attack, reality show contestants shelter in a TV studio, where they must deal with more than flesh-eating hordes."
TV Show,Queer Eye,2020,5 Seasons,Reality TV,"An all-new “Fab Five” advise men on fashion, grooming, food, culture and design in this modern reboot of the Emmy Award-winning reality series."
TV Show,Alone,2019,1 Season,Reality TV,"Equipped with limited resources, an isolated group of individuals is subjected to the harsh conditions of the wilderness and must survive — or tap out."
TV Show,The Big Flower Fight,2020,1 Season,Reality TV,"Ten pairs of florists, sculptors and garden designers face off in a friendly floral fight to see who can build the biggest, boldest garden sculptures."
TV Show,Magic for Humans,2020,3 Seasons,Reality TV,"From baffling people on the street to orchestrating elaborate tricks, Justin Willman blends good-natured magic with grown-up laughs."
TV Show,Strangers from Hell,2019,1 Season,TV Horror,Unpleasant events disturb the life of an aspiring crime fiction writer when he becomes a resident of an apartment building teeming with shady neighbors.
TV Show,Restaurants on the Edge,2020,2 Seasons,Reality TV,Three food and design experts travel the world to revive failing restaurants by connecting them to the local culture beyond their gorgeous views.
TV Show,Hoarders,2020,1 Season,Reality TV,"This reality series enters the worlds of compulsive hoarders, whose addiction to acquisition overwhelms not just their homes but also their lives."
TV Show,Nadiya’s Time to Eat,2020,1 Season,Reality TV,"On this cooking show, Nadiya Hussain serves up delicious shortcuts, vital ingredients and fast favorites — perfect for today's time-strapped families."
TV Show,Win the Wilderness,2020,1 Season,Reality TV,"Six couples compete to prove they've got the survival skills to win the deed to an extraordinary home deep in the vast, rugged wilderness of Alaska."
TV Show,Cooked with Cannabis,2020,1 Season,Reality TV,"Chefs compete to get the hosts and special guests high on elevated cannabis cuisine with their artful use of leafy herb, THC infusions and CBD sauces."
TV Show,The Circle France,2020,1 Season,Reality TV,"Status and strategy collide in this social media competition where online players flirt, befriend and catfish their way toward 100,000 euros."
TV Show,Wassup Man GO!,2020,1 Season,Reality TV,"Famously unfiltered star Joon Park goes to Los Angeles for an audition – and for a colorful, totally personal romp through the city he calls home."
TV Show,J-Style Trip,2020,1 Season,Reality TV,Megastar Jay Chou joins his A-list friends in this globe-trotting variety show packed with music and magic tricks.
TV Show,Bloodride,2020,1 Season,TV Horror,"The doomed passengers aboard a spectral bus head toward a gruesome, unknown destination in this deliciously macabre horror anthology series."
TV Show,The Circle Brazil,2020,1 Season,Reality TV,"Be yourself or someone else? In this fun reality competition, online players try their best to flirt, bond and catfish their way to a R$300,000 prize."
TV Show,Passion. Panache. Pep,2020,1 Season,Reality TV,"From delicious delicacies to dream destinations, this collection features vibrant stories on cultural trends across food, fashion and travel in India."
TV Show,Spectros,2020,1 Season,TV Horror,A group of teens get caught up in a supernatural clash as vengeful spirits from centuries past rise up in the Liberdade district of São Paulo.
TV Show,Love Is Blind,2021,1 Season,Reality TV,"Nick and Vanessa Lachey host this social experiment where single men and women look for love and get engaged, all before meeting in person."
TV Show,Palazuelos mi rey,2019,1 Season,Reality TV,"This reality series follows entrepreneur and soap opera star Roberto Palazuelos as he builds his hotel empire and juggles riches, women and drama."
TV Show,Ainori Love Wagon: African Journey,2019,1 Season,Reality TV,"To find love, seven strangers leave Japan and embark on a journey through the continent of Africa together. Challenges, adventure and romance await!"
